conceptType,conceptUri,preferredLabel,status,skillType,reuseLevel,altLabels,description,broaderConceptUri,broaderConceptPT
KnowledgeSkillCompetence,http://data.europa.eu/esco/skill/3e25fd3e-2bcd-4320-9587-0aadf7fb93b1,asesorar sobre la protección del suelo y del agua,released,skill/competence,sector-specific,,"Asesorar sobre métodos para proteger el suelo y las fuentes de agua frente a la contaminación, como por ejemplo frente a la lixiviación del nitrato, que es responsable de la erosión del terreno.
	",http://data.europa.eu/esco/skill/062a9fde-cd91-44f9-9a2f-9e2bc3b281fd,asesorar sobre cuestiones ambientales
KnowledgeSkillCompetence,http://data.europa.eu/esco/skill/3e37d714-4d65-416d-a138-46f7e2a98073,diseñar instalaciones para bombas de calor,released,skill/competence,sector-specific,,"Diseñar un sistema de bomba de calor, en particular los cálculos de la pérdida o transmisión de calor, la capacidad necesaria, monovalente o bivalente, los balances energéticos y la reducción del ruido.
	",http://data.europa.eu/esco/skill/39fa260c-4f85-48e3-83ce-e292e696c233,diseñar sistemas o equipos eléctricos o electrónicos
KnowledgeSkillCompetence,http://data.europa.eu/esco/skill/3ecde258-d1c6-4d6a-bfa7-ec4c5e4fc700,diseñar soluciones de mezclado ecológicas,released,skill/competence,occupation-specific,,"Diseñar soluciones de mezclado en las que se utilicen ingredientes biológicos en lugar de sintéticos. Evaluar la posibilidad de utilizar aceites vegetales, rellenos y polímeros y los avances recientes en este sentido.
	",http://data.europa.eu/esco/skill/c23e0a2f-f04b-45bc-b0dd-20571f6b502c,elaborar medidas y procedimientos operativos
KnowledgeSkillCompetence,http://data.europa.eu/esco/skill/3edfa33c-c644-4a9a-acd1-e82039daa663,promover el uso del transporte sostenible,released,skill/competence,sector-specific,,"Promover el uso del transporte sostenible para reducir la huella de carbono y el ruido, así como para aumentar la seguridad y la eficiencia de los sistemas de transporte. Determinar el rendimiento en relación con el uso del transporte sostenible, fijar objetivos para promover el uso del transporte sostenible y proponer alternativas de transporte inocuas para el medio ambiente.
   ",http://data.europa.eu/esco/skill/469e19ed-a0bd-445a-ae2d-4ba9430e296b | http://data.europa.eu/esco/skill/efb60300-0d55-4b2c-8038-8409587a4727,"fomentar la sostenibilidad | promocionar productos, servicios o programas"
KnowledgeSkillCompetence,http://data.europa.eu/esco/skill/3f82a026-8a37-4b54-9ebb-7702b66eeb24,realizar investigaciones ambientales,released,skill/competence,sector-specific,efectuar investigaciones ambientales | llevar a cabo investigaciones ambientales,"Llevar a cabo investigaciones ambientales cuando sea necesario, comprobando los procedimientos reglamentarios, las posibles actuaciones legales u otros tipos de reclamaciones.",http://data.europa.eu/esco/skill/c4376e35-add7-43a0-8b2e-f5741f0df8fe,realizar investigaciones forenses y policiales
KnowledgeSkillCompetence,http://data.europa.eu/esco/skill/4021ae85-8f3d-44e8-ac64-eeebac97f3ce,entender las especies de caza,released,knowledge,sector-specific,conocer las especies de caza,"Comprender la biología y ecología de especies de caza relevantes incluyendo las aves de caza, los ciervos y la pesca.",http://data.europa.eu/esco/isced-f/0511,biología
KnowledgeSkillCompetence,http://data.europa.eu/esco/skill/407b1474-7cfb-4538-823b-7667604f0267,restaurar el medio natural afectado por pruebas de perforación,released,skill/competence,occupation-specific,restablecer el entorno natural dañado por pruebas de perforación,Restaurar la zona de perforación a su condición ambiental natural en caso de que no se realice la perforación.,http://data.europa.eu/esco/skill/aca5081a-ceb0-4028-9cc5-1daafd4f86f9,desarrollar soluciones
KnowledgeSkillCompetence,http://data.europa.eu/esco/skill/40f65a56-ccbe-4601-9f32-1cc6cdd24f28,gestión de residuos,released,knowledge,cross-sector,,"Los métodos, materiales y reglamentos utilizados para la recogida, el transporte, el tratamiento y la eliminación de residuos. Esto incluye el reciclado y el seguimiento de la eliminación de residuos.",http://data.europa.eu/esco/isced-f/1021,saneamiento de la comunidad
KnowledgeSkillCompetence,http://data.europa.eu/esco/skill/40fa39b5-0f69-432a-b5ea-b01b5d98649a,eliminar residuos peligrosos,released,skill/competence,cross-sector,tirar residuos peligrosos | deshacerse de residuos peligrosos | gestionar residuos peligrosos,Eliminar los materiales peligrosos como sustancias químicas o radiactivas de acuerdo con las normas ambientales y en materia de salud y seguridad.,http://data.europa.eu/esco/skill/8bde58aa-9d5b-422b-801c-ff9186dd648e | http://data.europa.eu/esco/skill/d2d9051a-10e1-41c5-9cfb-bbdc58016176,manipular y eliminar materiales peligrosos | aplicar las normas de seguridad en el ámbito laboral
KnowledgeSkillCompetence,http://data.europa.eu/esco/skill/41168850-6e3f-4fc8-afd5-9337f0c66190,evaluar el impacto ambiental de las actividades acuícolas,released,skill/competence,sector-specific,determinar el impacto ambiental de las actividades acuícolas | analizar el impacto ambiental de las actividades acuícolas,"Medir el impacto ambiental de las actividades acuícolas de una empresa. Tener en cuenta factores como la calidad del mar y las aguas superficiales, los hábitats de los peces y las plantas marinas y los riesgos relacionados con la calidad del aire, el olor y el ruido.",http://data.europa.eu/esco/skill/e541c69c-ea80-4b17-87cb-4001d0b9d303 | http://data.europa.eu/esco/skill/444d3725-902f-49aa-9363-7de405bb991d | http://data.europa.eu/esco/skill/d519fadd-85bf-475f-bf14-c53a0290687d | http://data.europa.eu/esco/skill/d86babea-bf8b-4552-81a8-daf706066ad6,evaluar el impacto ambiental | determinar el impacto de determinadas actividades acuícolas | hacer seguimiento de condiciones medioambientales | gestionar el impacto medioambiental de las operaciones
KnowledgeSkillCompetence,http://data.europa.eu/esco/skill/41de7eb8-be07-4822-ba85-b76e9b8d6e4e,gestión sostenible de los bosques,released,knowledge,sector-specific,,"La administración y el uso de las tierras forestales de una forma y con una intensidad tales que mantengan su productividad, biodiversidad, capacidad de regeneración y vitalidad, así como su potencial para atender, ahora y en el futuro, las funciones ecológicas, económicas y sociales relevantes a escala local, nacional y mundial de modo que no causen daño a otros ecosistemas.
	",http://data.europa.eu/esco/isced-f/0821,silvicultura
KnowledgeSkillCompetence,http://data.europa.eu/esco/skill/4300b453-9bcf-474c-9ee3-92ec2229720c,normas mundiales de información sobre la sostenibilidad,released,knowledge,sector-specific,,"El marco estandarizado mundial para la presentación de información que permite a las organizaciones cuantificar y comunicar su impacto ambiental, social y de gobernanza.
	",http://data.europa.eu/esco/isced-f/0412,"gestión financiera, administración bancaria y seguros"
KnowledgeSkillCompetence,http://data.europa.eu/esco/skill/442328a8-8a11-4e15-b80c-402a9bd5844d,investigar sobre los procesos climatológicos,released,skill/competence,cross-sector,,Llevar a cabo investigaciones sobre los sucesos característicos que se producen en la atmósfera durante las interacciones y transformaciones de varios componentes atmosféricos y distintas condiciones atmosféricas.,http://data.europa.eu/esco/skill/7eafec38-621a-4b6e-9298-bfe70ec0b253,realizar estudios académicos o de mercado
KnowledgeSkillCompetence,http://data.europa.eu/esco/skill/44493977-83c4-49e0-88b2-28435da57cd0,reducir el impacto ambiental en la región,released,skill/competence,occupation-specific,reducir el impacto ambiental en el territorio | reducir el impacto ambiental en el área | reducir el impacto ambiental en zonas circundantes,"Minimizar el desperdicio de materiales y eliminar los desechos correctamente. Minimizar los daños a las plantas, las características y las zonas circundantes.",http://data.europa.eu/esco/skill/64acded2-d944-4f85-a703-cfe9375f706a,manejar equipos agrícolas o forestales
KnowledgeSkillCompetence,http://data.europa.eu/esco/skill/444d3725-902f-49aa-9363-7de405bb991d,determinar el impacto de determinadas actividades acuícolas,released,skill/competence,sector-specific,medir el impacto ambiental de determinadas actividades acuícolas | determinar el impacto ambiental de determinadas actividades acuícolas | examinar el impacto de determinadas actividades acuícolas | identificar el impacto de determinadas actividades acuícolas,"Identificar y medir los impactos biológicos, fisicoquímicos de la actividad acuícola específica en el medio ambiente. Realizar todas las pruebas necesarias, incluida la recogida y el procesamiento de muestras para análisis.",http://data.europa.eu/esco/skill/23d7bd85-d8d5-4455-b64d-3b0998f2425d,medir dimensiones y propiedades relacionadas
KnowledgeSkillCompetence,http://data.europa.eu/esco/skill/44a4f189-7414-402c-9c1d-c85743f34d0c,llevar un registro de las operaciones de reciclaje,released,skill/competence,cross-sector,,Mantener registros y procesar datos y cifras sobre el tipo y volumen de las diferentes operaciones de reciclaje.,http://data.europa.eu/esco/skill/7837ef5c-2c81-4a89-8227-b4d4f1f7331e | http://data.europa.eu/esco/skill/06fdd94c-292d-49e3-9c78-bbcbc2088232,mantener archivos profesionales | mantener registros operativos
KnowledgeSkillCompetence,http://data.europa.eu/esco/skill/44d5340c-45df-4478-9e55-2363342a7324,diseño de soluciones de reforma de edificios,released,skill/competence,sector-specific,,"Incorporar a una cosa un componente o elemento que no se instaló durante la fabricación o añadir algo que no tenía en la construcción original. Se utiliza en relación con la instalación de nuevos sistemas de edificios, como la calefacción, pero también podría referirse a la obra del edificio, por ejemplo, incorporar materiales de aislamiento o doble acristalamiento. Diseñar soluciones para reformar edificios residenciales y comerciales existentes con el fin de mejorar sus prestaciones, por ejemplo reduciendo el consumo de energía y agua. Evaluar la gama de tecnologías de reforma disponibles y seleccionar las más adecuadas en función de las características del edificio.
	",http://data.europa.eu/esco/skill/b2c688b0-9106-466d-8b88-eafdfe608e7d | http://data.europa.eu/esco/skill/cc0a45a7-4883-4122-af11-7ca6c45a37c2 | http://data.europa.eu/esco/skill/2eea3fd6-82ee-4334-8e36-62a0707cade1,diseñar estructuras o instalaciones | diseñar sistemas envolventes para edificios | diseñar la hermeticidad de los edificios
KnowledgeSkillCompetence,http://data.europa.eu/esco/skill/450aeb6d-5f23-4e08-b088-3bbefbfb9f2d,ecología acuática,released,knowledge,cross-sector,ciencia de la ecología acuática | ciencia de la hidroecología | hidroecología,"La ecología acuática es el estudio de los organismos acuáticos, cómo interactúan, donde viven, y lo que hacen.",http://data.europa.eu/esco/isced-f/0521,ciencias del medio ambiente
KnowledgeSkillCompetence,http://data.europa.eu/esco/skill/4562497f-836c-415a-b5ce-4ec3b5766d09,proponer ingredientes alternativos para las mezclas de caucho,released,skill/competence,occupation-specific,,"Identificar ingredientes de las mezclas de caucho potencialmente tóxicos y proponer ingredientes o mezclas alternativos con una funcionalidad similar.
	",http://data.europa.eu/esco/skill/aca5081a-ceb0-4028-9cc5-1daafd4f86f9,desarrollar soluciones
KnowledgeSkillCompetence,http://data.europa.eu/esco/skill/456f68b4-ca28-4029-a67f-7813b2c6cb4d,ética alimentaria,released,knowledge,sector-specific,,"Conjunto de valores y principios éticos que guían la producción, la distribución y el consumo de alimentos. Abarca una gran variedad de cuestiones, como la seguridad alimentaria, la sostenibilidad medioambiental, la sensibilidad cultural, las prácticas laborales justas, el bienestar animal y la responsabilidad social. La ética alimentaria puede abarcar la responsabilidad colectiva e individual.
	",http://data.europa.eu/esco/isced-f/0223,filosofía y ética
KnowledgeSkillCompetence,http://data.europa.eu/esco/skill/458d8ab9-a385-4e78-9638-1c3f9ce3c586,eliminar productos químicos,released,skill/competence,sector-specific,,"Eliminar los productos químicos y tratamientos de forma segura con arreglo a procedimientos de gestión de residuos en el sitio.
	",http://data.europa.eu/esco/skill/18f36e41-209a-4691-8381-e830eddbaae1 | http://data.europa.eu/esco/skill/8bde58aa-9d5b-422b-801c-ff9186dd648e | http://data.europa.eu/esco/skill/2416dc09-6384-409e-8b1d-80bb7a2e7369,organizar reactivos químicos | manipular y eliminar materiales peligrosos | manipular productos químicos
KnowledgeSkillCompetence,http://data.europa.eu/esco/skill/45b2a257-1c28-4c84-bc71-a4871e398c54,analizar posibles emplazamientos de parques eólicos,released,skill/competence,sector-specific,estudiar la posible ubicación de parques eólicos,"Realizar trabajos de investigación in situ y con el empleo de un atlas eólico para evaluar las distintas ubicaciones que podrían ser adecuadas para la construcción de grupos de turbinas eólicas, realizar asimismo investigaciones de seguimiento de la ubicación para ayudar en el desarrollo de los planes de construcción.",http://data.europa.eu/esco/skill/3eef7ff2-3ade-41d4-b084-2bd2a3949e1c,evaluar terrenos o bienes inmuebles
KnowledgeSkillCompetence,http://data.europa.eu/esco/skill/45b79278-465a-4eed-8809-369318bab119,desarrollar estrategias de descontaminación de yacimientos,released,skill/competence,sector-specific,desarrollar proyectos de recuperación de yacimientos | desarrollar estrategias de rehabilitación de yacimientos,Realizar estudios de campo y proporcionar asesoramiento sobre áreas con contaminación en el suelo o las aguas subterráneas en zonas industriales y yacimientos. Diseñar métodos para el almacenamiento del suelo excavado. Desarrollar estrategias para rehabilitar los yacimientos mineros agotados y devolverlos a un estado natural.,http://data.europa.eu/esco/skill/c23e0a2f-f04b-45bc-b0dd-20571f6b502c | http://data.europa.eu/esco/skill/e4ff825c-7376-4135-93cd-3892fd67b7c1,elaborar medidas y procedimientos operativos | desarrollar estrategias de recuperación ambiental
KnowledgeSkillCompetence,http://data.europa.eu/esco/skill/46454506-fb7c-4ad7-84e0-d4a6a5589ea1,diseño de edificios de consumo de energía nulo,released,knowledge,sector-specific,diseño arquitectónico sostenible,El principio de diseño y construcción según el cual la cantidad neta de energía utilizada por el edificio equivale a la cantidad de energía renovable generada por el propio edificio. El concepto se refiere a construcciones autosostenibles.,http://data.europa.eu/esco/isced-f/0731,arquitectura y urbanismo
KnowledgeSkillCompetence,http://data.europa.eu/esco/skill/467cfa0a-f6d8-4f07-a770-11d2ea3546cd,reducir las emisiones del curtido,released,skill/competence,sector-specific,,"Ajustar la formulación de la operación de acabado en función del tipo de mercado de destino del cuero evitando las emisiones de compuestos orgánicos volátiles.
	",http://data.europa.eu/esco/skill/8064ae65-5d1b-44e1-9aaf-246a4285a9a6,cumplir las leyes y normas sobre protección medioambiental
KnowledgeSkillCompetence,http://data.europa.eu/esco/skill/469e19ed-a0bd-445a-ae2d-4ba9430e296b,fomentar la sostenibilidad,released,skill/competence,cross-sector,,"Promover el concepto de sostenibilidad al público, colegas y compañeros de trabajo a través de discursos, visitas guiadas, exposiciones y talleres.",http://data.europa.eu/esco/skill/efb60300-0d55-4b2c-8038-8409587a4727,"promocionar productos, servicios o programas"
KnowledgeSkillCompetence,http://data.europa.eu/esco/skill/47d491a9-f7c0-4b13-a10f-983d3aa0113e,ingeniería de seguridad,released,knowledge,cross-sector,,"Estudio de los riesgos asociados a los diseños y sistemas proyectados mediante ingeniería, la prevención de accidentes y los beneficios para la seguridad derivados de la reducción de muertes y lesiones. Esta disciplina se centra en analizar y mitigar posibles peligros en los procesos de ingeniería.
	",http://data.europa.eu/esco/isced-f/0710 | http://data.europa.eu/esco/skill/6f1edc19-191f-4ba5-a048-ee69aff05bab,ingeniería y profesiones afines sin mayor definición | ingeniería de protección
KnowledgeSkillCompetence,http://data.europa.eu/esco/skill/492214f5-5bfd-4f2a-9a48-c36240ce100d,respetar políticas respetuosas del medio ambiente en la producción de alimentos,released,skill/competence,sector-specific,aplicar políticas respetuosas del medio ambiente en la fabricación de alimentos | trabajar conforme a políticas favorables al medio ambiente en la producción de alimentos,"Garantizar una política respetuosa con el medio ambiente cuando trabaje con recursos naturales como carne, frutas y verduras. Esto equivale a gestionar los recursos de la manera más eficiente y respetuosa con la naturaleza, intentando al mismo tiempo minimizar la presión sobre el ecosistema.",http://data.europa.eu/esco/skill/2aaad52d-599e-4e77-a681-bbc236825821 | http://data.europa.eu/esco/skill/4c3ab565-747c-4db3-8c47-79e8d6f98cf4 | http://data.europa.eu/esco/skill/8064ae65-5d1b-44e1-9aaf-246a4285a9a6,evaluar el impacto ambiental de la conducta personal | adoptar vías para reducir el impacto negativo del consumo | cumplir las leyes y normas sobre protección medioambiental
KnowledgeSkillCompetence,http://data.europa.eu/esco/skill/49298916-2090-4b08-ac57-5cfedaa5af36,reducir el impacto de la fabricación de calzado en el medioambiente,released,skill/competence,sector-specific,reducir el impacto medioambiental de la fabricación de calzado | limitar el impacto medioambiental de la fabricación de calzado | reducir los efectos de la fabricación de calzado en el medioambiente | reducir el impacto que la fabricación de calzado pueda tener en el medioambiente | controlar el impacto medioambiental de la fabricación de calzado,Evaluar el impacto ambiental de la fabricación de calzado y minimizar los riesgos medioambientales. Reducir las prácticas laborales ecológicamente nocivas en las diferentes fases de la fabricación de calzado.,http://data.europa.eu/esco/skill/4c3ab565-747c-4db3-8c47-79e8d6f98cf4 | http://data.europa.eu/esco/skill/e541c69c-ea80-4b17-87cb-4001d0b9d303 | http://data.europa.eu/esco/skill/062a9fde-cd91-44f9-9a2f-9e2bc3b281fd,adoptar vías para reducir el impacto negativo del consumo | evaluar el impacto ambiental | asesorar sobre cuestiones ambientales
KnowledgeSkillCompetence,http://data.europa.eu/esco/skill/4aba6668-6118-4953-804b-869cef94422a,eliminar residuos no peligrosos,released,skill/competence,cross-sector,desechar residuos no peligrosos | reciclar residuos no peligrosos,Eliminar los residuos que no presenten ningún riesgo para la salud y la seguridad de manera conforme con los procedimientos de reciclado y gestión de residuos.,http://data.europa.eu/esco/skill/61d1dab2-6007-4b7c-9380-cd88207fa30f,eliminar residuos o escombros no peligrosos
KnowledgeSkillCompetence,http://data.europa.eu/esco/skill/4b5f0aeb-875b-4afb-befc-2465b45602d8,inspeccionar procedimientos de reciclaje,released,skill/competence,sector-specific,examinar flujos de reciclaje | controlar procesos de reciclaje | verificar sistemas de reciclaje,"Inspeccionar la aplicación de procedimientos de gestión y reciclaje de residuos en una organización, y la legislación aplicable, a fin de garantizar su cumplimiento.",http://data.europa.eu/esco/skill/15fa3879-ac0e-46e6-ae36-609bae9c19c3,hacer seguimiento de actividades operativas
KnowledgeSkillCompetence,http://data.europa.eu/esco/skill/4c3ab565-747c-4db3-8c47-79e8d6f98cf4,adoptar vías para reducir el impacto negativo del consumo,released,skill/competence,transversal,,"Aplicar principios, políticas y reglamentación centrados en la sostenibilidad ambiental, en especial en la reducción de los residuos, el consumo de energía y agua, la reutilización y el reciclado de productos, y la participación en la economía colaborativa.
  ",http://data.europa.eu/esco/skill/80cf002a-6586-4db7-9c9a-88325a9a5e1b,hacer uso de capacidades y competencias medioambientales
KnowledgeSkillCompetence,http://data.europa.eu/esco/skill/4c4235a9-a1fb-403f-a173-37d9297c218c,reciclar estiércol,released,skill/competence,sector-specific,,"Aplicar técnicas de gestión del estiércol con una frecuencia apropiada con el fin de reutilizarlo como nutrientes orgánicos para el suelo y disminuir las repercusiones para el medio ambiente.
   ",http://data.europa.eu/esco/skill/61d1dab2-6007-4b7c-9380-cd88207fa30f,eliminar residuos o escombros no peligrosos
KnowledgeSkillCompetence,http://data.europa.eu/esco/skill/4c5fed97-939f-4050-adc0-7adaf15065e5,planificar el desarrollo de recursos hídricos,released,skill/competence,occupation-specific,organizar el desarrollo de recursos acuíferos | organizar el desarrollo de recursos hídricos | organizar el desarrollo de recursos del agua | planificar el desarrollo de recursos del agua | planificar el desarrollo de recursos acuíferos,Controlar la lluvia y el uso del agua para organizar el desarrollo de los recursos hídricos.,http://data.europa.eu/esco/skill/d519fadd-85bf-475f-bf14-c53a0290687d,hacer seguimiento de condiciones medioambientales
KnowledgeSkillCompetence,http://data.europa.eu/esco/skill/4ca83b9d-afa0-49f8-b7af-e4e6a42ad299,principios de la producción vegetal,released,knowledge,sector-specific,principios de la producción de plantas | principios de la producción agrícola,"Principios del crecimiento de cultivos, ciclo natural, cuidados de la naturaleza, condiciones de crecimiento y principios de producción ecológica y sostenible. Criterios de calidad y requisitos aplicables a las semillas, plantas y cultivos.",http://data.europa.eu/esco/isced-f/0811,producción agrícola y ganadera
KnowledgeSkillCompetence,http://data.europa.eu/esco/skill/4d032f82-6279-48e6-9892-116440a071e3,asesorar sobre prevención de la contaminación,released,skill/competence,cross-sector,aconsejar sobre prevención de la contaminación | facilitar información sobre prevención de la contaminación,Asesorar a las personas y organizaciones sobre el desarrollo y la ejecución de acciones que contribuyan a la prevención de la contaminación y a sus riesgos asociados.,http://data.europa.eu/esco/skill/062a9fde-cd91-44f9-9a2f-9e2bc3b281fd | http://data.europa.eu/esco/skill/045f71e6-0699-4169-8a54-9c6b96f3174d,asesorar sobre cuestiones ambientales | asesorar a otras personas
KnowledgeSkillCompetence,http://data.europa.eu/esco/skill/4e09e2d2-e317-47d2-bf5e-1d6c66be3efc,eficiencia energética de los edificios,released,knowledge,cross-sector,,Factores que contribuyen a reducir el consumo energético de los edificios. Técnicas de construcción y renovación utilizadas para conseguirlo. Legislación y procedimientos relativos a la eficiencia energética de los edificios.,http://data.europa.eu/esco/isced-f/0713,electricidad y energía
KnowledgeSkillCompetence,http://data.europa.eu/esco/skill/4e0a7f6e-b546-4cc6-9f8b-53e4fa31a426,diseñar redes inteligentes,released,skill/competence,sector-specific,,"Diseñar el sistema de redes inteligentes y realizar los cálculos pertinentes tomando como base la carga calorífica, las curvas de caudales clasificados, las simulaciones energéticas, etc.
   ",http://data.europa.eu/esco/skill/39fa260c-4f85-48e3-83ce-e292e696c233,diseñar sistemas o equipos eléctricos o electrónicos
KnowledgeSkillCompetence,http://data.europa.eu/esco/skill/4e0ba879-1cf3-4260-822b-2c2e3cc5e269,instalar sistemas de energía eólica en tierra,released,skill/competence,occupation-specific,,"Instalar sistemas que generan energía eléctrica a través de tecnologías de energía eólica en tierra. Colocar las turbinas en la base, instalar la conexión eléctrica y conectar las redes del parque eólico.
	",http://data.europa.eu/esco/skill/a7065828-10aa-4aba-b7d4-f23a30df5060 | http://data.europa.eu/esco/skill/52797dce-911c-4e6d-b0cb-491f6469014f,"instalar y reparar aparatos eléctricos, electrónicos y de precisión | instalar equipos eléctricos y electrónicos"
KnowledgeSkillCompetence,http://data.europa.eu/esco/skill/4e6cfb60-9579-4822-8a5e-424bc0c8835c,bienestar de los animales,released,knowledge,cross-sector,bienestar animal | protección de los animales | salud y bienestar de los animales,"Las necesidades de bienestar animal reconocidas universalmente aplicables a las especies, la situación y la ocupación. Estas son:

 
  necesidad de un entorno adecuado
necesidad de una dieta adecuada
necesidad de poder exhibir patrones de comportamiento normales
necesidad de habitar con, o separados de, otros animales
necesidad de ser protegidos del dolor, el sufrimiento, las lesiones y las enfermedades.",http://data.europa.eu/esco/isced-f/0841,veterinaria
KnowledgeSkillCompetence,http://data.europa.eu/esco/skill/4e87c852-602a-4a0e-b8d8-20709ce14ac5,evaluar el ciclo de vida de los recursos,released,skill/competence,sector-specific,,"Evaluar el uso y el posible reciclaje de materias primas durante todo el ciclo de vida del producto. Tener en cuenta la normativa aplicable, como el paquete de medidas sobre la economía circular de la Comisión Europea.
	",http://data.europa.eu/esco/skill/062a9fde-cd91-44f9-9a2f-9e2bc3b281fd,asesorar sobre cuestiones ambientales
KnowledgeSkillCompetence,http://data.europa.eu/esco/skill/4ee4ed1d-dc38-48e0-a9e6-a6b64f316ea6,políticas relativas al agua,released,knowledge,cross-sector,políticas hidrológicas | políticas sobre el agua | entender las políticas sobre el agua,"El marco de políticas, estrategias, instituciones y reglamentaciones relativas al agua.
	",http://data.europa.eu/esco/isced-f/1021,saneamiento de la comunidad
