conceptType,conceptUri,preferredLabel,status,skillType,reuseLevel,altLabels,description,broaderConceptUri,broaderConceptPT
KnowledgeSkillCompetence,http://data.europa.eu/esco/skill/b30c2dd2-996c-4984-9c68-ce05bf26f1e1,formar al personal en programas de reciclaje,released,skill/competence,cross-sector,,Formar a los empleados en el tipo de métodos y programas de reciclado disponibles para una empresa y todos los procedimientos y las políticas de la misma que deben tenerse en cuenta.,http://data.europa.eu/esco/skill/9601b2a8-68e4-4906-9306-a23679b8f0b0 | http://data.europa.eu/esco/skill/6c4fa8c8-e9e1-49b5-897f-6b61fe649488 | http://data.europa.eu/esco/skill/699e7c26-6502-4e78-a823-3656ff5a5b8b,supervisar personal | formar sobre procedimientos operativos | instruir a otras personas
KnowledgeSkillCompetence,http://data.europa.eu/esco/skill/b34f8562-9fcc-4e58-bd1c-8088ebadd315,asesorar sobre la conservación de la naturaleza,released,skill/competence,sector-specific,asesorar sobre la protección de la naturaleza,Proporcionar información y sugerir medidas de conservación de la naturaleza.,http://data.europa.eu/esco/skill/062a9fde-cd91-44f9-9a2f-9e2bc3b281fd | http://data.europa.eu/esco/skill/045f71e6-0699-4169-8a54-9c6b96f3174d,asesorar sobre cuestiones ambientales | asesorar a otras personas
KnowledgeSkillCompetence,http://data.europa.eu/esco/skill/b422efe7-b151-4120-86ae-db11a48dd0fa,asesorar sobre recuperación ambiental,released,skill/competence,cross-sector,facilitar información sobre recuperación ambiental | aconsejar sobre rehabilitación ambiental,Asesorar sobre el desarrollo y la ejecución de acciones destinadas a eliminar las fuentes de polución y contaminación del medio ambiente.,http://data.europa.eu/esco/skill/062a9fde-cd91-44f9-9a2f-9e2bc3b281fd | http://data.europa.eu/esco/skill/045f71e6-0699-4169-8a54-9c6b96f3174d,asesorar sobre cuestiones ambientales | asesorar a otras personas
KnowledgeSkillCompetence,http://data.europa.eu/esco/skill/b4bd4b00-be51-4631-b202-dcb0e33c0899,proteger a los animales de caza,released,skill/competence,occupation-specific,cuidar a los animales de caza | salvaguardar a los animales de caza | controlar la caza de animales | preservar los animales de caza,Evitar la caza sin licencia mediante patrullas nocturnas de la zona.,http://data.europa.eu/esco/skill/8064ae65-5d1b-44e1-9aaf-246a4285a9a6,cumplir las leyes y normas sobre protección medioambiental
KnowledgeSkillCompetence,http://data.europa.eu/esco/skill/b4db1a85-2488-4dc9-bd53-3dcb3f9deac7,principios de la fertilización,released,knowledge,cross-sector,conocimientos sobre los principios de la fertilización de vegetales | conocimientos sobre los principios de la fertilización | principios de la fertilización de vegetales,"El estudio de las cuestiones climáticas y medioambientales, relacionadas con plantas y estructura edáfica en la producción agronómica.",http://data.europa.eu/esco/isced-f/0811,producción agrícola y ganadera
KnowledgeSkillCompetence,http://data.europa.eu/esco/skill/b552832c-ad26-4901-b76c-232a53c74aba,coordinar la generación de electricidad,released,skill/competence,sector-specific,gestionar la generación de electricidad | administrar la generación de electricidad | supervisar la producción eléctrica,Comunicar la demanda actual de generación de electricidad a los trabajadores e instalaciones de generación de electricidad con el fin de garantizar que la generación de energía eléctrica pueda aumentarse o reducirse en consecuencia.,http://data.europa.eu/esco/skill/75d8e5d9-bef3-418b-9011-01bff9f27207 | http://data.europa.eu/esco/skill/a19c5139-1250-4a60-9c31-a3243cca06cc,liderar a otras personas | comunicar con compañeros de trabajo y clientes
KnowledgeSkillCompetence,http://data.europa.eu/esco/skill/b55376e1-41c3-45f8-9b35-d3e7b1288a33,evaluar la huella ecológica de los vehículos,released,skill/competence,sector-specific,,"Evaluar la huella ecológica de los vehículos y utilizar varios métodos para analizar emisiones de gases de efecto invernadero como las emisiones de CO2.
	",http://data.europa.eu/esco/skill/f7fc7bf8-f41d-44af-81e3-09b88e9779e6,realizar pruebas con sistemas o equipos eléctricos y mecánicos
KnowledgeSkillCompetence,http://data.europa.eu/esco/skill/b589ce7c-588f-4045-be2d-9332c2d2278d,ingeniería de superficies,released,knowledge,cross-sector,estudios de ingeniería de superficies,"La disciplina de la ingeniería que estudia la manera de contrarrestar el deterioro ambiental, como la corrosión y la deformación de las superficies de los materiales, alterando las propiedades de las superficies y haciéndolas resistentes al entorno en el que van a ser utilizadas.",http://data.europa.eu/esco/isced-f/0712 | http://data.europa.eu/esco/skill/b1b118c4-3291-484e-b64d-6d51fd5da8b3,tecnología de protección del medio ambiente | ingeniería ambiental
KnowledgeSkillCompetence,http://data.europa.eu/esco/skill/b589fa82-f177-4cce-9fb4-31bbbebf792b,química verde,released,knowledge,sector-specific,,"Proceso de creación de productos químicos que disminuyen o anulan las repercusiones ambientales negativas causadas por el uso de sustancias peligrosas. Sigue todas las fases de la generación del producto químico, desde el diseño hasta la fabricación y su eliminación.
	",http://data.europa.eu/esco/isced-f/0711,ingeniería y procesos químicos
KnowledgeSkillCompetence,http://data.europa.eu/esco/skill/b71fc6e4-14eb-488b-9f26-a7c15fd6d6e8,llevar cabo un estudio de viabilidad sobre la energía geotérmica,released,skill/competence,sector-specific,,"Analizar y evaluar la viabilidad de un sistema de energía geotérmica. Llevar a cabo un estudio estandarizado para determinar los costes, las limitaciones y los componentes disponibles y realizar una investigación para apoyar el proceso de toma de decisiones. Investigar el mejor tipo de sistema en combinación con el tipo de bomba de calor disponible.
	",http://data.europa.eu/esco/skill/d74df140-eb69-43e2-bac9-1cafc824d702 | http://data.europa.eu/esco/skill/ec528c47-65f4-4187-9dc1-5a8889f84a06,ejecutar estudio de viabilidad | analizar operaciones empresariales
KnowledgeSkillCompetence,http://data.europa.eu/esco/skill/b7a26b32-c457-49aa-9a78-25ade10090e3,realizar el mantenimiento de turbinas eólicas,released,skill/competence,sector-specific,,"Llevar a cabo todas las actividades necesarias para mantener las turbinas eólicas en un buen estado de funcionamiento. Lubricar las partes en movimiento, como las cajas de engranajes y los rodamientos, verificar las conexiones del sistema y solucionar todo problema importante que pueda surgir.
	",http://data.europa.eu/esco/skill/ec0401f1-f690-46be-934b-f6f5611085f5,"mantener aparatos eléctricos, electrónicos y de precisión"
KnowledgeSkillCompetence,http://data.europa.eu/esco/skill/b970e437-2f8b-42e3-ae49-6718a0cca44f,reutilización del agua,released,knowledge,cross-sector,principios de reutilización del agua | procesos de reutilización del agua,Los principios de los procesos de reutilización del agua en sistemas de circulación complejos.,http://data.europa.eu/esco/isced-f/0732,construcción e ingeniería civil
KnowledgeSkillCompetence,http://data.europa.eu/esco/skill/b9931096-a9b9-4db4-b210-6fcada68c2ff,coordinar el transporte de residuos,released,skill/competence,occupation-specific,administrar el transporte de basuras | gestionar el transporte de residuos | controlar el transporte de residuos,"Organizar el transporte de residuos peligrosos o no peligrosos de un cliente a una instalación de tratamiento, almacenamiento o eliminación de residuos, y garantizar que todos los procedimientos sean conformes con la legislación en materia de medio ambiente.",http://data.europa.eu/esco/skill/e6eeb84c-ad99-42e2-b883-e6ce338aef59 | http://data.europa.eu/esco/skill/4c3ab565-747c-4db3-8c47-79e8d6f98cf4,planificar operaciones y procesos de producción | adoptar vías para reducir el impacto negativo del consumo
KnowledgeSkillCompetence,http://data.europa.eu/esco/skill/ba54cf3c-dd64-48ea-8a9d-ee621a05fb07,analizar el consumo de energía de sistemas de ventilación,released,skill/competence,sector-specific,,"Calcular y evaluar el consumo total de energía de un sistema de ventilación teniendo en cuenta el consumo de electricidad y la pérdida de calor del sistema y del edificio, de manera anual, con el fin de elegir un modelo apropiado.
	",http://data.europa.eu/esco/skill/f5f15f9c-6334-4728-8dc5-3a20a00dfc37,realizar cálculos
KnowledgeSkillCompetence,http://data.europa.eu/esco/skill/ba8b530e-8f6f-4667-b734-3358797c0595,homologación de vehículos,released,knowledge,sector-specific,,"El proceso para certificar que un vehículo o sus sistemas y componentes cumplen los requisitos establecidos en la reglamentación y en las normas medioambientales, administrativas y técnicas aplicables.
	",http://data.europa.eu/esco/isced-f/1041,servicios de transporte
KnowledgeSkillCompetence,http://data.europa.eu/esco/skill/bb4f3174-8d64-478b-8d9b-5f37cbf557b7,gestionar los flujos de visitantes en zonas naturales protegidas,released,skill/competence,sector-specific,,"Controlar los flujos de visitantes en zonas naturales protegidas con el fin de reducir al mínimo el impacto de los visitantes a largo plazo y preservar la flora y la fauna locales, con arreglo a la normativa ambiental.
   ",http://data.europa.eu/esco/skill/15fa3879-ac0e-46e6-ae36-609bae9c19c3,hacer seguimiento de actividades operativas
KnowledgeSkillCompetence,http://data.europa.eu/esco/skill/bb859329-0cd8-45c0-a09f-48b6dcd9fc1a,proteger los árboles,released,skill/competence,sector-specific,cuidar los árboles | controlar la tala de árboles | preservar los árboles,Preservar los árboles teniendo en cuenta la salud y las condiciones de los árboles y los planes para la preservación y conservación de la zona. Esto incluye la tala de árboles o ramas de árboles aplicando conocimientos de la biología del árbol.,http://data.europa.eu/esco/skill/8064ae65-5d1b-44e1-9aaf-246a4285a9a6 | http://data.europa.eu/esco/skill/8df12fb1-7f41-4068-8d05-007e8fec8f33,cumplir las leyes y normas sobre protección medioambiental | realizar labores de conservación forestal
KnowledgeSkillCompetence,http://data.europa.eu/esco/skill/bbfb0e36-807c-492f-bed2-267224ba7bc7,investigar sobre cómo prevenir el desperdicio de alimentos,released,skill/competence,cross-sector,,"Investigar y evaluar métodos, equipos y costes para reducir y gestionar el desperdicio de alimentos. Realizar un seguimiento de los datos de medición registrados e identificar áreas de mejora en lo relativo a la prevención del desperdicio de alimentos.
	",http://data.europa.eu/esco/skill/7eafec38-621a-4b6e-9298-bfe70ec0b253,realizar estudios académicos o de mercado
KnowledgeSkillCompetence,http://data.europa.eu/esco/skill/bc97c755-2174-4d02-adaf-21b8b1863742,gestionar los aspectos medioambientales del transporte por vías navegables interiores,released,skill/competence,sector-specific,aspectos del medioambiente relacionados con el transporte por vías navegables interiores,Plantearse los aspectos ecológicos de la operación de buques con el fin de utilizarlos de manera eficaz y respetuosa con el medio ambiente. Comprender los aspectos medioambientales a la hora de navegar por vías navegables interiores.,http://data.europa.eu/esco/skill/8064ae65-5d1b-44e1-9aaf-246a4285a9a6,cumplir las leyes y normas sobre protección medioambiental
KnowledgeSkillCompetence,http://data.europa.eu/esco/skill/bce60ecd-ceee-4dbd-b619-70c9789ec634,poner a prueba la hermeticidad y la presión de circuitos de refrigeración,released,skill/competence,occupation-specific,,"Llevar a cabo ensayos sobre la presión del sistema en equipos de refrigeración, aire acondicionado o bombas de calor utilizando gas comprimido y una bomba de vacío para comprobar la hermeticidad del circuito de refrigeración y de sus partes.
	",http://data.europa.eu/esco/skill/a7065828-10aa-4aba-b7d4-f23a30df5060,"instalar y reparar aparatos eléctricos, electrónicos y de precisión"
KnowledgeSkillCompetence,http://data.europa.eu/esco/skill/bd70f004-e1d6-43f0-96f1-59c014a4ea01,coordinar esfuerzos ambientales,released,skill/competence,cross-sector,coordinar esfuerzos en materia de medio ambiente | gestionar esfuerzos ambientales | coordinar actividades ambientales,"Organizar e integrar todos los esfuerzos medioambientales de la empresa, incluidos el control de la contaminación, el reciclado, la gestión de residuos, la salud medioambiental, la conservación y la energía renovable.",http://data.europa.eu/esco/skill/4c3ab565-747c-4db3-8c47-79e8d6f98cf4 | http://data.europa.eu/esco/skill/8064ae65-5d1b-44e1-9aaf-246a4285a9a6,adoptar vías para reducir el impacto negativo del consumo | cumplir las leyes y normas sobre protección medioambiental
KnowledgeSkillCompetence,http://data.europa.eu/esco/skill/be973dc1-6aa9-4aed-954c-644affe78639,colocar tiras aislantes,released,skill/competence,cross-sector,fijar bandas de aislamiento | instalar bandas de aislamiento,Aplicar tiras aislantes que impidan el intercambio de aire entre las zonas exteriores e interiores.,http://data.europa.eu/esco/skill/0edd863d-b02d-4714-a1a2-835d6dd23c55,instalar materiales de aislamiento
KnowledgeSkillCompetence,http://data.europa.eu/esco/skill/bed97655-cb0c-4f05-bfd7-9a79d058619d,proyectos de conservación de la vida silvestre,released,knowledge,sector-specific,proyectos para conservar la vida silvestre | proyectos de conservación de la flora y la fauna | proyectos para conservar la flora y la fauna,Los proyectos de conservación de la fauna y la flora silvestres cuyo objetivo es proteger y preservar los ecosistemas y los hábitats de una amplia gama de animales amenazados por la urbanización.,http://data.europa.eu/esco/isced-f/0522,medio ambientes naturales y vida silvestre
KnowledgeSkillCompetence,http://data.europa.eu/esco/skill/bf4779c9-ce55-4110-a996-a7014ca3f1f9,tecnologías de automoción ecológicas,released,knowledge,sector-specific,,"Tecnologías que permiten el desarrollo de prácticas sostenibles en la industria de automoción. Se centran en reducir los efectos negativos de esta industria en el medio ambiente, como la contaminación atmosférica o el uso de fuentes no renovables, y en utilizar métodos ecológicos en el diseño y la fabricación de productos de automoción.
	",http://data.europa.eu/esco/isced-f/0712,tecnología de protección del medio ambiente
KnowledgeSkillCompetence,http://data.europa.eu/esco/skill/bf9a2403-850d-4dd3-b266-edaabebc8ab0,evaluar diseños de edificios integrados,released,skill/competence,sector-specific,,"Utilizar objetivos y metas como medio para medir el éxito de propuestas de diseño. Aplicar, combinar y evaluar métodos avanzados para analizar la interrelación entre sistemas energéticos, conceptos arquitectónicos, el diseño de edificios, el uso de edificios, las condiciones climáticas exteriores y los sistemas de calefacción, ventilación y aire acondicionado.
	",http://data.europa.eu/esco/skill/1f2950c0-ef1e-44b4-9a55-125ccd7b78af,analizar y evaluar información y datos
KnowledgeSkillCompetence,http://data.europa.eu/esco/skill/c0133edf-845a-47bf-968b-bd4a5bd03bbf,utilizar equipos de calentamiento acuícola,released,skill/competence,sector-specific,manipular equipos de calentamiento para actividades acuícolas | operar equipos de calentamiento para actividades acuícolas,"Operar equipo de calefacción y bombeo de agua adecuado, como calentadores eléctricos, intercambiadores de calor, bombas de calor y bombas solares.",http://data.europa.eu/esco/skill/8bf9699c-f964-4e4b-ac3d-55aface09cbc,manejar equipos de producción o distribución de energía
KnowledgeSkillCompetence,http://data.europa.eu/esco/skill/c0ccbd15-36f3-4515-ae0b-b4062d225ee2,cumplir la normativa sobre materiales prohibidos,released,skill/competence,sector-specific,adherirse a las normas sobre sustancias prohibidas | seguir las normas sobre sustancias prohibidas | cumplir la normativa en materia de sustancias prohibidas | respetar la normativa sobre sustancias prohibidas | seguir la normativa sobre sustancias prohibidas,"Cumplir la normativa que prohíbe los metales pesados en soldadura, los retardadores de llama en plásticos y los plastificantes de ftalato en aislamientos de plásticos y juegos de cables, en el marco de las Directivas de la UE RoHS/WEEE y la legislación china RoHS.",http://data.europa.eu/esco/skill/35dc2a23-cdc3-4291-930f-927ba2911949,velar por el cumplimiento de la legislación
KnowledgeSkillCompetence,http://data.europa.eu/esco/skill/c1de3963-05eb-4e45-8496-58156a345fb1,transferir demandas energéticas,released,skill/competence,sector-specific,controlar el suministro energético | regular el suministro energético,"Dar cabida a un cierre temporal de los sistemas de generación de energía eléctrica mediante una transferencia de la demanda energética. El objetivo es limitar las interrupciones del suministro de energía a los clientes, mientras se identifica y se aborda un determinado problema.",http://data.europa.eu/esco/skill/8bf9699c-f964-4e4b-ac3d-55aface09cbc,manejar equipos de producción o distribución de energía
KnowledgeSkillCompetence,http://data.europa.eu/esco/skill/c214d86e-fbb8-45c0-87d4-f2cefc954057,seleccionar tecnologías sostenibles para el diseño,released,skill/competence,sector-specific,,"Elaborar un diseño holístico que incluya medidas pasivas que se complementen con tecnologías activas de una manera razonable.
	",http://data.europa.eu/esco/skill/01c03003-516d-43c6-8477-45c472413521 | http://data.europa.eu/esco/skill/62afcfdd-a2a6-4143-bafb-59c77e15a01c,asesorar sobre materiales de construcción | asesorar sobre productos y servicios
KnowledgeSkillCompetence,http://data.europa.eu/esco/skill/c291df22-0d6b-4cea-8feb-11c350a33081,controlar los niveles de radiación,released,skill/competence,cross-sector,gestionar niveles de radiación | verificar niveles de radiación,"Utilizar equipos y técnicas de medición y ensayo para identificar los niveles de radiación o sustancias radiactivas con el fin de controlar la exposición y reducir al mínimo los riesgos para la salud, la seguridad y el medio ambiente.",http://data.europa.eu/esco/skill/d2d9051a-10e1-41c5-9cfb-bbdc58016176 | http://data.europa.eu/esco/skill/d519fadd-85bf-475f-bf14-c53a0290687d,aplicar las normas de seguridad en el ámbito laboral | hacer seguimiento de condiciones medioambientales
KnowledgeSkillCompetence,http://data.europa.eu/esco/skill/c29fed5c-f03b-4389-b110-29b6db00cd01,eliminar residuos no alimenticios en la industria alimentaria,released,skill/competence,sector-specific,reciclar residuos no alimenticios de la industria alimentaria | deshacerse de los residuos no alimenticios de la industria alimentaria,Eliminar los residuos no alimenticios en la industria alimentaria aplicando procedimientos aceptados desde el punto de vista medioambiental.,http://data.europa.eu/esco/skill/61d1dab2-6007-4b7c-9380-cd88207fa30f,eliminar residuos o escombros no peligrosos
KnowledgeSkillCompetence,http://data.europa.eu/esco/skill/c3108ed8-de97-41fc-9ff7-8c028e662734,biotecnología de la acuicultura,released,knowledge,cross-sector,campo de la biotecnología de la acuicultura,Biotecnología y reacciones en cadena de la polimerasa para los estudios de métodos de producción de acuicultura sostenibles.,http://data.europa.eu/esco/skill/61bef658-d7f9-4759-b1b0-0f9cb3bc581a | http://data.europa.eu/esco/isced-f/0831,biotecnología | pesca
KnowledgeSkillCompetence,http://data.europa.eu/esco/skill/c345ad5f-6b37-4861-98b2-769d819309a0,biología animal,released,knowledge,cross-sector,zoología | evolución de los animales | clasificación de los animales,"La estructura, evolución y clasificación de los animales y cómo interactúan con sus ecosistemas.",http://data.europa.eu/esco/isced-f/0511 | http://data.europa.eu/esco/skill/9433da85-70fa-4a25-8f96-71fa59dd1989,biología
KnowledgeSkillCompetence,http://data.europa.eu/esco/skill/c36dc79e-3414-4283-a85d-f664a523837f,educar al público sobre la vida silvestre,released,skill/competence,cross-sector,informar al público sobre temas relacionados con la vida silvestre | transmitir información al público sobre temas relacionados con la vida silvestre,Hablar con grupos de adultos y niños para enseñarles a disfrutar del bosque sin dañarlo ni dañarse a sí mismos. Dar charlas en colegios o hablar con grupos específicos de jóvenes si se le pide. Desarrollar y enseñar programas relacionados con la conservación de la naturaleza.,http://data.europa.eu/esco/skill/335be43a-3267-400e-b5cb-c9e234dc7544,enseñar materias académicas o profesionales
KnowledgeSkillCompetence,http://data.europa.eu/esco/skill/c3ac5c4c-b4b9-4842-b871-43e12cfc0442,prácticas de construcción ecológica,released,knowledge,sector-specific,,"Las prácticas relacionadas con el diseño y la creación de estructuras de construcción de manera medioambientalmente responsable, rentable y eficiente en el uso de los recursos. Las prácticas de construcción ecológicas, como el uso de materiales de construcción respetuosos con el medio ambiente, complementan las prácticas de construcción clásicas para tratar de conseguir que los edificios tengan un ciclo de vida sostenible y de altas prestaciones.
	",http://data.europa.eu/esco/isced-f/0732,construcción e ingeniería civil
KnowledgeSkillCompetence,http://data.europa.eu/esco/skill/c3bb5700-a94d-407a-8cd0-147727378f25,consecuencias de la contaminación urbana,released,knowledge,sector-specific,impacto de la contaminación urbana | efectos de la contaminación urbana,"La recogida de contaminantes creados por las ciudades y sus efectos en el aire, el agua y el suelo en todo el medio ambiente. 
 
 
 ",http://data.europa.eu/esco/isced-f/0712,tecnología de protección del medio ambiente
KnowledgeSkillCompetence,http://data.europa.eu/esco/skill/c4867766-50f8-489e-98d7-262da5589c0a,productos solares,released,knowledge,cross-sector,,"Variedades y las características clave de los productos solares, como paneles solares, calentadores de agua solares o cargadores alimentados con energía solar. Además, el conocimiento de sus funcionalidades, componentes y requisitos legales.
	",http://data.europa.eu/esco/isced-f/0713 | http://data.europa.eu/esco/skill/f8413360-6114-40de-a276-c59b764b9913,electricidad y energía | tecnologías de energías renovables
KnowledgeSkillCompetence,http://data.europa.eu/esco/skill/c49eb4a4-7b5f-44e6-b346-7153879ac86b,sistemas de calefacción industrial,released,knowledge,cross-sector,,"Los sistemas de calefacción alimentados por gas, madera, combustible, biomasa, energía solar y otras fuentes de energía renovables, así como sus principios de ahorro energético, aplicables específicamente a los edificios e instalaciones industriales.",http://data.europa.eu/esco/isced-f/0713,electricidad y energía
KnowledgeSkillCompetence,http://data.europa.eu/esco/skill/c4b03a17-a93e-4a8e-9846-4c4d469d4001,agroecología,released,knowledge,sector-specific,,"El estudio y la aplicación de conceptos y principios ecológicos y agronómicos para sistemas de producción agrícola.
   ",http://data.europa.eu/esco/isced-f/0811 | http://data.europa.eu/esco/skill/a8429098-ddac-481b-91e7-688d021c092e,producción agrícola y ganadera | ecología
KnowledgeSkillCompetence,http://data.europa.eu/esco/skill/c4ba12d1-4698-42fa-8abb-789462ea2586,proteger el medio ambiente frente al impacto de las tecnologías digitales,released,skill/competence,occupation-specific,proteger el entorno frente al impacto de las tecnologías digitales | proteger el medio ambiente ante el impacto de las tecnologías digitales,Ser consciente del impacto medioambiental de las tecnologías digitales y su uso.,http://data.europa.eu/esco/skill/8064ae65-5d1b-44e1-9aaf-246a4285a9a6 | http://data.europa.eu/esco/skill/2aaad52d-599e-4e77-a681-bbc236825821 | http://data.europa.eu/esco/skill/426ceaba-6867-481c-bb6b-aee3933da7d2,cumplir las leyes y normas sobre protección medioambiental | evaluar el impacto ambiental de la conducta personal | seguridad de las tecnologías de la información y de las comunicaciones
KnowledgeSkillCompetence,http://data.europa.eu/esco/skill/c4e9f0d0-bbdd-42d7-83a5-2c131f6d67c2,desarrollar políticas energéticas,released,skill/competence,sector-specific,elaborar políticas energéticas | planificar estrategias energéticas | planificar medidas energéticas,Desarrollar y mantener la estrategia de una organización con respecto a su rendimiento energético.,http://data.europa.eu/esco/skill/8ed41305-4abf-4b54-9f8f-0e043d26feba,elaborar políticas y legislación
KnowledgeSkillCompetence,http://data.europa.eu/esco/skill/c4f97536-866b-4a4f-b91d-da07809ef2d8,llevar a cabo un estudio de viabilidad sobre el hidrógeno,released,skill/competence,sector-specific,,"Analizar y evaluar el uso de hidrógeno como combustible alternativo. Comparar costes, tecnologías y fuentes disponibles para la producción, el transporte y el almacenamiento de hidrógeno. Tener en cuenta el impacto medioambiental para contribuir al proceso de toma de decisiones.
	",http://data.europa.eu/esco/skill/ec528c47-65f4-4187-9dc1-5a8889f84a06 | http://data.europa.eu/esco/skill/d74df140-eb69-43e2-bac9-1cafc824d702,analizar operaciones empresariales | ejecutar estudio de viabilidad
