conceptType,conceptUri,preferredLabel,status,skillType,reuseLevel,altLabels,description,broaderConceptUri,broaderConceptPT
KnowledgeSkillCompetence,http://data.europa.eu/esco/skill/72886bc5-eeb0-42d5-9b01-f83b4cf138b4,consumo de agua,released,knowledge,occupation-specific,,"Los factores que intervienen en el cálculo y la estimación del consumo de agua en una vivienda o en un recinto, y los métodos gracias a los que se puede reducir u optimizar.",http://data.europa.eu/esco/isced-f/1021,saneamiento de la comunidad
KnowledgeSkillCompetence,http://data.europa.eu/esco/skill/73576419-31c2-4e45-8e30-ab1afec3db4e,utilizar materiales y componentes sostenibles,released,skill/competence,cross-sector,,"Identificar y seleccionar materiales y componentes inocuos para el medio ambiente. Decidir que se sustituyan determinados materiales por unos que sean inocuos para el medio ambiente, manteniendo el mismo nivel de funcionalidad y las demás características del producto.
   ",http://data.europa.eu/esco/skill/8064ae65-5d1b-44e1-9aaf-246a4285a9a6,cumplir las leyes y normas sobre protección medioambiental
KnowledgeSkillCompetence,http://data.europa.eu/esco/skill/73997f48-cd9d-4724-872d-86ecbb2ed9a2,especies vegetales,released,knowledge,sector-specific,especies de plantas | tipos de especies de plantas,"La variedad de plantas, árboles y arbustos y sus características especiales. ",http://data.europa.eu/esco/isced-f/0511,biología
KnowledgeSkillCompetence,http://data.europa.eu/esco/skill/73a9561d-112c-4d8a-9d5f-b2c11c5bbd5f,gestionar residuos,released,skill/competence,cross-sector,tirar residuos | eliminar de residuos | administrar residuos,"Gestionar o eliminar cantidades significativas de materiales residuales o materiales peligrosos, de conformidad con la legislación, respetando así las responsabilidades medioambientales y empresariales. Garantizar que se disponga de las licencias y los permisos necesarios y que se apliquen prácticas de gestión razonables, normas industriales o prácticas agrícolas comúnmente aceptadas.
	",http://data.europa.eu/esco/skill/f8c676de-c871-424f-9a65-77059d07910a | http://data.europa.eu/esco/skill/4c3ab565-747c-4db3-8c47-79e8d6f98cf4,manipular y eliminar residuos y materiales peligrosos | adoptar vías para reducir el impacto negativo del consumo
KnowledgeSkillCompetence,http://data.europa.eu/esco/skill/73cc1ce2-4ada-4ae1-9f8e-d7efadcd52f6,diseñar un sistema de calefacción eléctrica,released,skill/competence,sector-specific,,"Diseñar los detalles de un sistema de calefacción eléctrica. Calcular la capacidad necesaria para la calefacción de locales en determinadas condiciones ajustándose al suministro de energía eléctrica disponible.
	",http://data.europa.eu/esco/skill/883eab8c-d8a6-4e8b-9b11-7d9001e172ab,diseñar sistemas y productos
KnowledgeSkillCompetence,http://data.europa.eu/esco/skill/7493634f-30ea-4f2f-8fd4-c78b4a309bf7,ecosistemas de agua dulce,released,knowledge,sector-specific,comprender los ecosistemas de agua dulce | conocer los ecosistemas de agua dulce,"Tipos y características naturales de los ecosistemas de agua dulce, como lagos, estanques, ríos, humedales, arroyos, etc.
	",http://data.europa.eu/esco/isced-f/0831,pesca
KnowledgeSkillCompetence,http://data.europa.eu/esco/skill/75f312e1-622b-4751-8d93-815b32feaf8d,prevención de la contaminación,released,knowledge,cross-sector,procedimientos para contrarrestar la contaminación | procedimientos para prevenir la contaminación,"Los procesos utilizados para evitar la contaminación: precauciones para no contaminar el medio ambiente, procedimientos anticontaminación y equipos asociados, así como posibles medidas de protección del medio ambiente.",http://data.europa.eu/esco/isced-f/0712,tecnología de protección del medio ambiente
KnowledgeSkillCompetence,http://data.europa.eu/esco/skill/7608e884-6f73-4205-a02a-ea7062a2337e,supervisar la eliminación de sustancias radioactivas,released,skill/competence,cross-sector,garantizar la eliminación de sustancias radioactivas de acuerdo con las procedimientos establecidos,"Garantizar la correcta gestión y eliminación de sustancias radiactivas utilizadas con fines médicos, de conformidad con los procedimientos establecidos.",http://data.europa.eu/esco/skill/8bde58aa-9d5b-422b-801c-ff9186dd648e,manipular y eliminar materiales peligrosos
KnowledgeSkillCompetence,http://data.europa.eu/esco/skill/761de590-ca64-423f-a5a7-8639abd8c615,tecnologías de microgeneración de energía,released,knowledge,sector-specific,,"Tecnologías que permiten que el proceso de generación a pequeña escala que es la recogida de energía de fuentes hipocarbónicas, como el sol, el viento o los caudales hídricos, produzca calor o electricidad. Las tecnologías de microgeneración de energía no se producen en grandes centrales eléctricas, lo que aumenta su eficiencia y elimina costes de distribución.
	",http://data.europa.eu/esco/isced-f/0713,electricidad y energía
KnowledgeSkillCompetence,http://data.europa.eu/esco/skill/761e1acc-d38b-4524-9890-6a119fb7e98c,apoyar el turismo local,released,skill/competence,sector-specific,,"Promover productos y servicios locales entre los visitantes y fomentar el uso de los operadores turísticos locales de un destino.
   ",http://data.europa.eu/esco/skill/f9db77be-eb63-4937-a0d0-b581733e7d2a,prestar apoyo para solucionar problemas
KnowledgeSkillCompetence,http://data.europa.eu/esco/skill/76f552ef-bb2d-4f66-83a8-ad205086967e,instruir al público acerca de la naturaleza,released,skill/competence,sector-specific,,"Hablar con diversas audiencias sobre, por ejemplo, información, conceptos, teorías o actividades relacionadas con la naturaleza y su conservación. Elaborar información escrita. Esta información puede presentarse en diferentes formatos, por ejemplo, letreros, fichas informativas, carteles, texto de sitios web, etc.",http://data.europa.eu/esco/skill/699e7c26-6502-4e78-a823-3656ff5a5b8b | http://data.europa.eu/esco/skill/e2bdf081-333a-414f-b8ac-93c76290f167,instruir a otras personas | proporcionar orientación y tutoría
KnowledgeSkillCompetence,http://data.europa.eu/esco/skill/77390acd-7cf6-4cb2-895a-16bc6b6d2058,vida silvestre,released,knowledge,sector-specific,flora y fauna,"Las especies animales no domesticadas, así como todas las plantas, hongos y otros organismos que crecen o viven silvestres en una zona sin ser introducidos por los seres humanos. Puede encontrarse fauna silvestre en todos los ecosistemas, como desiertos, bosques, bosques húmedos, llanuras, pastizales y otras zonas, incluidas las zonas urbanas más desarrolladas, todos ellos con distintas formas de fauna silvestre.
	",http://data.europa.eu/esco/isced-f/0522,medio ambientes naturales y vida silvestre
KnowledgeSkillCompetence,http://data.europa.eu/esco/skill/77f109c4-3107-4d2a-a512-5160ac103933,analizar datos medioambientales,released,skill/competence,sector-specific,,Analizar datos que interpreten correlaciones entre actividades humanas y efectos medioambientales.,http://data.europa.eu/esco/skill/9af1bd12-01bd-4d6a-947b-69e64f23150a | http://data.europa.eu/esco/skill/1b70a55d-b8a4-49fc-96c6-15ab4cff2522 | http://data.europa.eu/esco/skill/a571ae14-3e16-4fd3-a615-5646e0b0b696 | http://data.europa.eu/esco/skill/ba1f6201-b206-4459-b178-706db34a851d | http://data.europa.eu/esco/skill/57231a22-4da7-49c8-97b8-75672feadf1e | http://data.europa.eu/esco/skill/1e77e42a-181f-4b48-8e74-201ce50ffc29 | http://data.europa.eu/esco/skill/1d6c7de4-350e-4868-a47b-333b4b0d9650 | http://data.europa.eu/esco/skill/81a2db2c-7e55-44d0-9cd9-74c25147d7cd | http://data.europa.eu/esco/skill/36ff57b0-637d-4a83-a0e8-d14f86f9f078,"procesar información cualitativa | utilizar técnicas de tratamiento de datos | analizar datos | analizar datos científicos o médicos | gestionar datos cuantitativos | interpretar datos actuales | evaluar datos, información y contenido digitales | analizar datos experimentales | analizar datos científicos"
KnowledgeSkillCompetence,http://data.europa.eu/esco/skill/7808ccb8-9797-4864-80e3-37119ca32b30,observar el proceso de formación de compost,released,skill/competence,occupation-specific,supervisar el proceso de compostaje | controlar el proceso de compostaje,Mezclar los materiales biodegradables respetando la proporción adecuada y controlar el proceso de degradación de residuos orgánicos.,http://data.europa.eu/esco/skill/bf4822d3-1f66-499d-afc9-151a9ba33e58,preparar mezclas o soluciones
KnowledgeSkillCompetence,http://data.europa.eu/esco/skill/7832b684-580c-4eaf-a8b3-322164b041ab,facilitar información sobre paneles solares,released,skill/competence,cross-sector,informar sobre instalaciones de paneles solares | informar sobre paneles fotovoltaicos | asesorar sobre aprovechamiento de la energía solar,"Proporcionar a las organizaciones y particulares que busquen métodos alternativos para proporcionar energía a las instalaciones y residencias información sobre los costes, beneficios y aspectos negativos de la instalación y uso de paneles solares, y qué debe tenerse en cuenta al considerar la compra e instalación de sistemas solares.",http://data.europa.eu/esco/skill/045f71e6-0699-4169-8a54-9c6b96f3174d | http://data.europa.eu/esco/skill/732cb4dd-af91-4c88-9a9f-5fc62144e500 | http://data.europa.eu/esco/skill/d54970ba-d9f2-41ec-a852-bbd1e5796823,asesorar a otras personas | facilitar información | facilitar información al público y a los clientes
KnowledgeSkillCompetence,http://data.europa.eu/esco/skill/79a5bc25-5b59-47bc-a4c2-fb8e8cb1ddf6,sistemas de redes eléctricas inteligentes ,released,knowledge,sector-specific,sistemas de redes inteligentes,"Las redes electricas inteligentes son redes de electricidad digitales. El sistema incluye el control electrónico digital de la producción, el suministro y el consumo de electricidad, la gestión de la información de los componentes y el ahorro de energía.
	",http://data.europa.eu/esco/isced-f/0713,electricidad y energía
KnowledgeSkillCompetence,http://data.europa.eu/esco/skill/7ac88283-80aa-4a1f-93f8-213cd2a469cb,diseñar sistemas de energía marina,released,skill/competence,sector-specific,,"Elaborar especificaciones de diseño para sistemas de energía marina y sus componentes de manera que se optimice el diseño a fin de tener una producción de energía segura y eficiente. Crear listas de comprobación para la inspección y el seguimiento de proyectos de instalaciones en alta mar finalizadas.
	",http://data.europa.eu/esco/skill/c34b06c4-d164-4e49-a784-89d47de42ec2,"diseñar materiales, sistemas o productos industriales"
KnowledgeSkillCompetence,http://data.europa.eu/esco/skill/7afd29d7-9c9f-4151-83f2-562b8c94a3af,aplicar conceptos de gestión del transporte,released,skill/competence,sector-specific,establecer conceptos de gestión del transporte | gestionar conceptos de organización del transporte,"Aplicar conceptos de gestión del sector del transporte para mejorar los procesos de transporte, reducir los residuos, aumentar la eficiencia y mejorar la preparación de los calendarios.",http://data.europa.eu/esco/skill/58bd927f-e4cc-4b61-a679-cb91b3f8075a | http://data.europa.eu/esco/skill/6a59e69f-4f2c-4277-bbb3-c7bb792569d5,seguir instrucciones y procedimientos | gestionar la estrategia de transporte de una empresa
KnowledgeSkillCompetence,http://data.europa.eu/esco/skill/7b3717e4-e963-44e0-b94f-1088a7242da0,cuidar plantas,released,skill/competence,sector-specific,curar plantas | regar plantas | cultivar plantas,"Determinar la necesidad de las actividades de cuidado y dispensar cuidados mediante el cultivo, el mantenimiento, el riego y la pulverización de las plantas y los árboles manualmente o mediante el uso de equipos apropiados, teniendo en cuenta las especies vegetales y siguiendo requisitos de seguridad.",http://data.europa.eu/esco/skill/b7c82b1b-cff9-4641-a62f-e4e28395eade,cultivar terrenos y plantar cultivos
KnowledgeSkillCompetence,http://data.europa.eu/esco/skill/7c2c81fe-b5f5-4691-a58d-7fd0a8b6c0e1,evitar la pérdida de calor del horno,released,skill/competence,occupation-specific,impedir que el horno pierda calor,Evitar la pérdida de calor sellando la puerta del horno con ladrillos y arcilla.,http://data.europa.eu/esco/skill/bdf2aa76-360d-429d-a967-bdb691f241fa,"manejar hornos, fraguas y equipos de secado"
KnowledgeSkillCompetence,http://data.europa.eu/esco/skill/7cefbd03-d544-4184-a9b4-caa1eea2a646,impacto ambiental del turismo,released,knowledge,sector-specific,huella medioambiental del turismo | impacto medioambiental del turismo | huella ambiental del turismo | impacto del turismo sobre el medio ambiente,Estudio de las repercusiones que tienen en el medio ambiente los viajes y las actividades turísticas en destinos vacacionales.,http://data.europa.eu/esco/isced-f/1015,"viajes, turismo y actividades recreativas"
KnowledgeSkillCompetence,http://data.europa.eu/esco/skill/7d70ed20-1c29-4ce3-bda5-9ba6c957a2d2,tipos de convertidores de energía undimotriz,released,knowledge,sector-specific,,"Los diversos tipos de dispositivos existentes para explotar la energía undimotriz, como boyas de absorción puntual, atenuadores superficiales, convertidores de energía de las olas oscilantes, dispositivos de rebosamiento o convertidores por presión diferencial sumergidos.
	",http://data.europa.eu/esco/isced-f/0713,electricidad y energía
KnowledgeSkillCompetence,http://data.europa.eu/esco/skill/7f321b88-3d16-4e30-8163-5494ca8ce978,hacer que otras personas adopten conductas positivas para el medio ambiente,released,skill/competence,transversal,,"Divulgar y promover conductas positivas para el medio ambiente en las redes sociales y en el trabajo.
  ",http://data.europa.eu/esco/skill/80cf002a-6586-4db7-9c9a-88325a9a5e1b,hacer uso de capacidades y competencias medioambientales
KnowledgeSkillCompetence,http://data.europa.eu/esco/skill/7f4d1dee-bc5a-495a-926b-17b383b8d8fd,normas de construcción ecológica,released,knowledge,sector-specific,,"Directrices sobre cómo diseñar y construir edificios sostenibles. Siguen el criterio de paliar las repercusiones ambientales de los edificios, al tiempo que se promueven prácticas ecológicas entre los ocupantes.
	",http://data.europa.eu/esco/isced-f/0732,construcción e ingeniería civil
KnowledgeSkillCompetence,http://data.europa.eu/esco/skill/7feca0cc-f0b3-470d-ba03-48c0f7cff286,educar sobre turismo sostenible,released,skill/competence,sector-specific,,"Desarrollar programas y recursos educativos para individuos o grupos guiados con el fin de facilitar información sobre el turismo sostenible y sobre los efectos de la interacción del ser humano en el medio ambiente, la cultura local y el patrimonio natural. Educar a los turistas sobre cómo tener un impacto positivo y concienciar sobre cuestiones ambientales.
   ",http://data.europa.eu/esco/skill/e2bdf081-333a-414f-b8ac-93c76290f167,proporcionar orientación y tutoría
KnowledgeSkillCompetence,http://data.europa.eu/esco/skill/7ff9cce1-6518-48db-8f59-2beb81508fb2,facilitar información sobre turbinas eólicas,released,skill/competence,sector-specific,informar sobre instalaciones de turbinas eólicas,"Informar a las organizaciones y particulares que busquen métodos de energías alternativas sobre el coste, los beneficios y los aspectos negativos de la instalación y uso de turbinas eólicas, tanto residenciales como comunes, y qué debe tenerse en cuenta al considerar la aplicación de la tecnología de aerogeneradores.",http://data.europa.eu/esco/skill/d54970ba-d9f2-41ec-a852-bbd1e5796823 | http://data.europa.eu/esco/skill/732cb4dd-af91-4c88-9a9f-5fc62144e500,facilitar información al público y a los clientes | facilitar información
KnowledgeSkillCompetence,http://data.europa.eu/esco/skill/8034a1ea-5ee0-4a84-8fd3-16411c8d86fb,agrosilvicultura,released,knowledge,sector-specific,,"La aplicación de sistemas y tecnologías de ordenación del territorio que integran árboles y otras plantas leñosas perennes junto con la explotación tradicional de tierras agrícolas, con el fin de preservar la producción agrícola y proteger, al mismo tiempo, el medio natural.
	",http://data.europa.eu/esco/isced-f/0821,silvicultura
KnowledgeSkillCompetence,http://data.europa.eu/esco/skill/81af8698-9873-4b3d-b6d2-8eb275bf170b,amenazas para el medio ambiente,released,knowledge,sector-specific,amenazas medioambientales | riesgos ambientales para la salud | problemas medioambientales,"Las amenazas para el medio ambiente relacionadas con peligros biológicos, químicos, nucleares, radiológicos y físicos.",http://data.europa.eu/esco/isced-f/0521,ciencias del medio ambiente
KnowledgeSkillCompetence,http://data.europa.eu/esco/skill/82423b5c-486f-42e7-b00e-7358757a8de5,tomar muestras de contaminantes,released,skill/competence,sector-specific,escoger muestras de contaminantes | seleccionar muestras de contaminantes | analizar muestras de contaminantes,Medir las concentraciones de contaminantes dentro de las muestras. Calcular la contaminación atmosférica o el flujo de gas en los procesos industriales. Identificar posibles riesgos para la seguridad o la salud como la radiación.,http://data.europa.eu/esco/skill/b5a1fc87-c9f2-41f4-a1ae-28e023715592 | http://data.europa.eu/esco/skill/5aec5b83-df71-483e-90b9-21e56a0a3cb2 | http://data.europa.eu/esco/skill/d2e8f452-ac19-4eed-b984-8f55d2a5b763,analizar muestras | medir el nivel de contaminación | hacer ensayos y análisis de sustancias
KnowledgeSkillCompetence,http://data.europa.eu/esco/skill/8248a071-5307-4a64-a62d-643a35ec31e2,tipos de paneles fotovoltaicos,released,knowledge,cross-sector,,"Tipos diferentes de células y paneles fotovoltaicos, con diferentes clasificaciones de eficiencia en diferentes tipos de meteorología, costes, durabilidad y vida útil, así como posibilidades de montaje.",http://data.europa.eu/esco/isced-f/0713,electricidad y energía
KnowledgeSkillCompetence,http://data.europa.eu/esco/skill/824fc4ec-4217-46c5-8a5c-f752bb0d2d73,biología de las plagas,released,knowledge,occupation-specific,biología de los insectos que forman plaga | biología de los insectos-plaga,Características biológicas de las plagas de insectos y roedores y su influencia en la elección de un método de gestión de plagas determinado.,http://data.europa.eu/esco/isced-f/0511,biología
KnowledgeSkillCompetence,http://data.europa.eu/esco/skill/829d1376-41bf-4c41-9bc3-62dce647677c,sistemas de iluminación artificial,released,knowledge,sector-specific,,"Tipos de iluminación artificial y su consumo de energía. La iluminación fluorescente de alta frecuencia, la iluminación LED, la luz natural y los sistemas de control programado permiten un uso eficiente de la energía.
	",http://data.europa.eu/esco/isced-f/0713,electricidad y energía
KnowledgeSkillCompetence,http://data.europa.eu/esco/skill/82fea746-853f-4f1b-8ab7-55de8619cccd,fabricación lean  ,released,knowledge,cross-sector,fabricación limpia,"La fabricación  ajustada es una metodología que se centra en reducir al mínimo los residuos dentro de un sistema de fabricación al tiempo que se maximiza la productividad.

	",http://data.europa.eu/esco/isced-f/0413,gestión y administración
KnowledgeSkillCompetence,http://data.europa.eu/esco/skill/8318ca1f-117e-4a21-a07a-5d7515a21035,impartir formación en materia de desarrollo y gestión del turismo sostenible,released,skill/competence,sector-specific,,"Impartir formación y creación de capacidad para trabajadores del sector turístico a fin de informarles de las mejores prácticas en cuanto al desarrollo y la gestión de destinos y paquetes turísticos, al tiempo que se procura tener un impacto mínimo en el medio ambiente y las comunidades locales y se preservan de forma estricta las zonas y las especies de flora y fauna protegidas.
   ",http://data.europa.eu/esco/skill/6c4fa8c8-e9e1-49b5-897f-6b61fe649488 | http://data.europa.eu/esco/skill/2cb27e30-2be7-4a09-9502-fdd2102c046b,formar sobre procedimientos operativos | impartir formación sobre cuestiones ambientales
KnowledgeSkillCompetence,http://data.europa.eu/esco/skill/83331548-2159-4b87-9177-c3cb29978540,inspeccionar árboles,released,skill/competence,cross-sector,examinar árboles | observar árboles | controlar árboles,Realizar inspecciones y reconocimientos de árboles.,http://data.europa.eu/esco/skill/d519fadd-85bf-475f-bf14-c53a0290687d,hacer seguimiento de condiciones medioambientales
KnowledgeSkillCompetence,http://data.europa.eu/esco/skill/83fc0b2b-6cd2-46af-b1ff-d3fc83604c26,eficiencia energética,released,knowledge,sector-specific,,"Campo de información sobre la reducción del consumo de energía. Abarca el cálculo del consumo de energía, el suministro de certificados y medidas de apoyo, el ahorro de energía mediante la reducción de la demanda, el fomento del uso eficiente de los combustibles fósiles y el fomento del uso de energías renovables.",http://data.europa.eu/esco/isced-f/0713,electricidad y energía
KnowledgeSkillCompetence,http://data.europa.eu/esco/skill/8550a96d-3970-46e1-83e1-371c59473ec4,ofrecer servicios de agroturismo,released,skill/competence,sector-specific,proporcionar servicios de agroturismo | ofrecer servicios de turismo rural,"Prestación de servicios para actividades de agroturismo en la explotación. Esto puede incluir la prestación de servicios de tipo alojamiento y desayuno, la restauración a pequeña escala, el apoyo a las actividades de agroturismo y ocio, como la equitación, las visitas locales guiadas, suministrar información sobre la producción y la historia de la explotación o la venta de productos agrícolas locales a pequeña escala.",http://data.europa.eu/esco/skill/e06f2d35-a160-46c2-89f1-9cae9c93c8b8,vender productos o servicios
KnowledgeSkillCompetence,http://data.europa.eu/esco/skill/8570573a-937b-406a-b4b2-1def0387d0d1,mantener sistemas de energía solar concentrada,released,skill/competence,sector-specific,realizar tareas de mantenimiento en sistemas de energía solar concentrada | garantizar el funcionamiento de sistemas de energía solar concentrada | realizar reparaciones en sistemas de energía solar concentrada,"Realizar labores de mantenimiento regular además de reparar sistemas que utilicen materiales reflectantes como lentes y espejos, y sistemas de seguimiento para concentrar la luz solar en un haz que alimente a una central eléctrica a través de su generación de calor.",http://data.europa.eu/esco/skill/ec0401f1-f690-46be-934b-f6f5611085f5,"mantener aparatos eléctricos, electrónicos y de precisión"
KnowledgeSkillCompetence,http://data.europa.eu/esco/skill/85947873-e99a-4b08-a4e3-743942710fea,gestionar proyectos de pesca,released,skill/competence,sector-specific,administrar proyectos de pesca | gestionar proyectos de conservación marina,Consultar con contratistas de los sectores tanto público como privado en proyectos de pesca como esfuerzos de restauración. Ir más allá de los planes propuestos y aportar conocimientos especializados. Preparar solicitudes de subvenciones para programas de pesca. Proporcionar asistencia técnica a los proyectos de pesca cívica. Estudiar el impacto de los cambios ambientales en las aguas. Resolver las reclamaciones de los ciudadanos. Preparar prescripciones para detectar problemas pesqueros y recomendar soluciones.,http://data.europa.eu/esco/skill/cd5efa8c-e44d-4cbc-91c6-796018dbed68 | http://data.europa.eu/esco/skill/190f64e1-b7b6-4c53-b20b-80f9215ef6ca,"gestionar proyectos | dirigir, supervisar y coordinar proyectos"
KnowledgeSkillCompetence,http://data.europa.eu/esco/skill/85f73cdf-fb6f-434d-8fff-fcd723834a90,realizar tareas de recuperación ambiental,released,skill/competence,sector-specific,ocuparse de tareas de recuperación ambiental | encargarse de tareas de recuperación del entorno,Llevar a cabo actividades que garanticen la eliminación de fuentes de polución y contaminación del medio ambiente de conformidad con la normativa de reparación medioambiental.,http://data.europa.eu/esco/skill/0d75a128-bd88-4c1b-b70d-8e963aeb490c | http://data.europa.eu/esco/skill/089ee650-297e-4716-87d1-440743b70a0d | http://data.europa.eu/esco/skill/8064ae65-5d1b-44e1-9aaf-246a4285a9a6,adoptar vías para reducir la contaminación | garantizar el cumplimiento de la legislación ambiental | cumplir las leyes y normas sobre protección medioambiental
KnowledgeSkillCompetence,http://data.europa.eu/esco/skill/8604cb5f-9e1f-427c-ba23-3c4a6853fe95,diseñar redes de recogida asociadas a parques eólicos,released,skill/competence,sector-specific,planificar redes de recogida asociadas a un parque eólico | desarrollar sistemas de recogida vinculados a un parque eólico,"Diseñar sistemas que interconecten turbinas eólicas individuales con un parque eólico y recojan y transfieran la energía a una subestación, lo que permitirá la transmisión de la energía eléctrica generada, garantizando que el sistema conecte las turbinas entre sí y la subestación de manera segura y eficiente.",http://data.europa.eu/esco/skill/c34b06c4-d164-4e49-a784-89d47de42ec2,"diseñar materiales, sistemas o productos industriales"
