conceptType,conceptUri,preferredLabel,status,altLabels,description,broaderConceptUri,broaderConceptPT
Occupation,http://data.europa.eu/esco/occupation/77abfaec-a250-4765-95fa-6091e8da1bba,ingeniero electromecánico/ingeniera electromecánica,released,ingeniera electromecánica | ingeniero electromecánico,"Los ingenieros electromecánicos diseñan y desarrollan equipos y maquinaria que utilizan tecnología tanto eléctrica como mecánica. Elaboran borradores y preparan documentos en los que se detallan los requisitos materiales, el proceso de montaje y otras especificaciones técnicas. También someten a ensayos y evalúan los prototipos. Además, supervisan el proceso de fabricación.",http://data.europa.eu/esco/occupation/86ca306c-ab99-420a-9e2a-aa73c5c4de22,ingeniero eléctrico/ingeniera eléctrica
Occupation,http://data.europa.eu/esco/occupation/7c132147-428b-4ea3-87e1-70f7abb691ce,farmacéutico/farmacéutica,released,farmacéutico | dispensador de servicios comerciales al por menor de productos farmacéuticos | farmacéutica | dispensadora de servicios comerciales al por menor de productos farmacéuticos,"Los farmacéuticos preparan y dispensan medicamentos de venta con y sin receta médica. Ofrecen información clínica sobre medicamentos, notifican sospechas de reacciones adversas y proporcionan apoyo personalizado a los clientes. Además, elaboran y ponen a prueba medicamentos en laboratorios y almacenan, conservan y distribuyen los medicamentos.",http://data.europa.eu/esco/isco/C2262,Farmacéuticos
Occupation,http://data.europa.eu/esco/occupation/7dea476a-dffe-4919-9ee2-fb222e283f41,profesor universitario de psicología/profesora universitaria de psicología,released,profesora universitaria de psicología | profesor universitario de psicología,"Los profesores universitarios de psicología son catedráticos de dicha materia, profesores, o profesores universitarios que forman en su disciplina de especialidad, la psicología —de carácter predominantemente académico— a estudiantes que han obtenido un título de enseñanza secundaria posobligatoria. Trabajan con sus ayudantes de investigación y ayudantes de apoyo al profesorado universitario en la preparación de clases teóricas y exámenes, en la puntuación de trabajos y exámenes, así como en la dirección de sesiones de repaso y tutorías para los estudiantes. También llevan a cabo investigaciones académicas en su respectiva área de especialidad dentro del ámbito de la psicología, publican sus trabajos y colaboran con otros compañeros de trabajo en la universidad.",http://data.europa.eu/esco/occupation/684fd8d5-9b40-4b02-a680-438f0082d923,profesor de educación superior/profesora de educación superiora
Occupation,http://data.europa.eu/esco/occupation/7f0fe7d3-54c6-41e9-88ba-9d4f0f1a46b4,ingeniero de microsistemas/ingeniera de microsistemas,released,ingeniero de microsistemas | ingeniera de microsistemas,"Los ingenieros de microsistemas se dedican a la investigación, el diseño, el desarrollo y la supervisión de la producción de sistemas microelectromecánicos (MEMS), que pueden integrarse en productos mecánicos, ópticos, acústicos y electrónicos.",http://data.europa.eu/esco/occupation/4d34a9ee-2653-4da0-bef7-f59294577224,ingeniero electrónico/ingeniera electrónica
Occupation,http://data.europa.eu/esco/occupation/7f2761eb-4edc-48ad-9fbf-eed0a0db9a21,físico/física,released,físico | física,"Los físicos son científicos que estudian fenómenos físicos. El tema central de su investigación depende de su especialización, que puede ir desde la física de partículas atómicas hasta el estudio de los fenómenos del universo. Aplican sus conclusiones a la mejora de la sociedad contribuyendo a la obtención de fuentes de abastecimiento energético, al tratamiento de enfermedades, al desarrollo de juegos, y a la creación de equipos y objetos de uso diario de última generación.",http://data.europa.eu/esco/isco/C2111,Físicos y astrónomos
Occupation,http://data.europa.eu/esco/occupation/82e37849-30ec-4461-a40e-263d4c984f88,paleontólogo/paleontóloga,released,paleontóloga | paleontólogo,"Los paleontólogos investigan y analizan las formas de vida que existían en eras pasadas del planeta Tierra. Se dedican a definir la senda evolutiva y la interacción con diferentes áreas geológicas de todo tipo de antiguos organismos y especies vegetales, polen y esporas, animales invertebrados y vertebrados, seres humanos, y huellas como pisadas, así como la ecología y el clima.",http://data.europa.eu/esco/occupation/c6196b21-20f9-4608-83fb-6f143afc740d,geólogo/geóloga
Occupation,http://data.europa.eu/esco/occupation/86a0c9ab-c3fa-41a3-ad3e-d0083036b3d6,mineralogista,released,,"Los mineralogistas estudian la composición, la estructura y otros aspectos físicos de la tierra. Analizan diversos minerales y utilizan equipos científicos para determinar su estructura y propiedades. Su trabajo se centra principalmente en la clasificación y la identificación de minerales mediante la toma de muestras y la realización de nuevos ensayos, análisis y exámenes.",http://data.europa.eu/esco/isco/C2114,Geólogos y geofísicos
Occupation,http://data.europa.eu/esco/occupation/89b87aa2-4008-4cc7-96f8-e2b5ffe59f28,ecólogo/ecóloga,released,ecólogo | ecóloga,"Los ecólogos llevan a cabo evaluaciones sobre la salud y la distribución de organismos —a saber, personas, plantas y animales—, así como sobre la relación entre los organismos y su entorno. Suelen contar con un ámbito de especialización —p. ej., agua dulce, fauna y flora marinas y terrestres— sobre el que investigan y cuyas tareas relacionadas llevan a cabo. ",http://data.europa.eu/esco/isco/C2133,Profesionales de la protección medioambiental
Occupation,http://data.europa.eu/esco/occupation/8b128a08-606f-4bb1-806e-07e0ed98b40e,profesor universitario de ciencias del espacio/profesora universitaria de ciencias del espacio,released,profesor universitario de astrofísica | profesor universitario de ciencias del espacio | profesora universitaria de ciencias del espacio | profesora universitaria de astrofísica,"Los profesores universitarios de ciencias del espacio son catedráticos de dicha materia, profesores, o profesores universitarios que forman en su disciplina de especialidad, las ciencias del espacio —de carácter predominantemente académico— a estudiantes que han obtenido un título de enseñanza secundaria posobligatoria. Trabajan con sus ayudantes de investigación y ayudantes de apoyo al profesorado universitario en la preparación de clases teóricas y exámenes, en la puntuación de trabajos y exámenes, así como en la dirección de sesiones de repaso y tutorías para los estudiantes. También llevan a cabo investigaciones académicas en su área de especialidad dentro del ámbito de las ciencias del espacio, publican sus trabajos y colaboran con otros compañeros de trabajo en la universidad.",http://data.europa.eu/esco/occupation/684fd8d5-9b40-4b02-a680-438f0082d923,profesor de educación superior/profesora de educación superiora
Occupation,http://data.europa.eu/esco/occupation/8c0f59c9-9a47-42e7-8287-aab19df4e6ab,ingeniero en microelectrónica/ingeniera en microelectrónica,released,ingeniero en microelectrónica | ingeniera en microelectrónica,"Los ingenieros en microelectrónica diseñan, desarrollan y supervisan la producción de pequeños aparatos y componentes electrónicos como los microprocesadores y los circuitos integrados.",http://data.europa.eu/esco/occupation/4d34a9ee-2653-4da0-bef7-f59294577224,ingeniero electrónico/ingeniera electrónica
Occupation,http://data.europa.eu/esco/occupation/920c22e1-10a1-4afa-86b3-c43da8488391,profesor universitario de trabajo social/profesora universitaria de trabajo social,released,profesor universitario de trabajo social | profesora universitaria de trabajo social,"Los profesores universitarios de trabajo social son profesionales que ejercen una doble función. Por un lado, la disciplina académica que presta servicios sociales —como el asesoramiento, la terapia o el apoyo, a individuos o grupos. Por otro, forman parte del mundo académico que imparte formación profesional, participando también en la investigación y el desarrollo del conocimiento, contribuyendo a encontrar soluciones a problemas sociales complejos y a aportar enfoques innovadores para mejorar dichos problemas.  Enseñan conocimientos, capacidades y valores de trabajo social para preparar a los estudiantes para participar en prácticas de trabajo social de ámbito cultural con diversas poblaciones y comunidades.",http://data.europa.eu/esco/occupation/684fd8d5-9b40-4b02-a680-438f0082d923,profesor de educación superior/profesora de educación superiora
Occupation,http://data.europa.eu/esco/occupation/92bb3d8c-8a9f-4cd7-80ec-247bbf173004,ingeniero especializado en equipos informáticos/ingeniera especializada en equipos informáticos,released,ingeniera especializada en equipos informáticos | ingeniera de hardware | ingeniero especializado en equipos informáticos | ingeniero de hardware,"Los ingenieros especializados en equipos informáticos diseñan y desarrollan sistemas y componentes de hardware informático, tales como placas de circuitos, módems e impresoras. Elaboran borradores de planos y planos de ensamblaje, desarrollan y prueban los prototipos, además de supervisar el proceso de producción.",http://data.europa.eu/esco/occupation/4d34a9ee-2653-4da0-bef7-f59294577224,ingeniero electrónico/ingeniera electrónica
Occupation,http://data.europa.eu/esco/occupation/9766cc19-5a64-4b3c-a741-71561285a419,profesor universitario de antropología/profesora universitaria de antropología,released,profesor universitario de antropología | profesora universitaria de antropología,"Los profesores universitarios de antropología son catedráticos de dicha materia, profesores, o profesores universitarios que forman en su disciplina de especialidad, la antropología —de carácter predominantemente académico— a estudiantes que han obtenido un título de enseñanza secundaria posobligatoria. Trabajan con sus ayudantes de investigación y ayudantes de apoyo al profesorado universitario en la preparación de clases teóricas y exámenes, en la puntuación de trabajos y exámenes, así como en la dirección de sesiones de repaso y tutorías para los estudiantes. También llevan a cabo investigaciones académicas en su área de especialidad dentro del ámbito de la antropología, publican sus trabajos y colaboran con otros compañeros de trabajo en la universidad.",http://data.europa.eu/esco/occupation/684fd8d5-9b40-4b02-a680-438f0082d923,profesor de educación superior/profesora de educación superiora
Occupation,http://data.europa.eu/esco/occupation/9851c83c-5670-4da0-964a-1ef0e682e30b,investigador de tanatología/investigadora de tanatología,released,investigadora de tanatología | investigador de tanatología,"Los investigadores de tanatología estudian la muerte y los muertos en diversos campos científicos, como la psicología, la sociología, la fisiología y la antropología. Contribuyen al crecimiento del conocimiento sobre aspectos de la muerte, como los fenómenos psicológicos del fallecimiento y de los que viven en su entorno.",http://data.europa.eu/esco/isco/C2632,"Sociólogos, antropólogos y afines"
Occupation,http://data.europa.eu/esco/occupation/9905cc76-d48b-49b1-94ab-17becb30be1a,profesor universitario de ciencias de la alimentación/profesora universitaria de ciencias de la alimentación,released,profesora universitaria de ciencias de la alimentación | profesor universitario de ciencias de la alimentación | profesor universitario de bromatología | profesora universitaria de bromatología,"Los profesores universitarios de ciencias alimentarias son catedráticos de dicha materia, profesores, o profesores universitarios que forman en su disciplina de especialidad, las ciencias alimentarias —de carácter predominantemente académico— a estudiantes que han obtenido un título de enseñanza secundaria posobligatoria. Trabajan con sus ayudantes de investigación y ayudantes de apoyo al profesorado universitario en la preparación de clases teóricas y exámenes, en la puntuación de trabajos y exámenes, así como en la dirección de sesiones de repaso y tutorías para los estudiantes. También llevan a cabo investigaciones académicas en su área de especialidad dentro del ámbito de las ciencias alimentarias, publican sus trabajos y colaboran con otros compañeros de trabajo en la universidad.",http://data.europa.eu/esco/occupation/684fd8d5-9b40-4b02-a680-438f0082d923,profesor de educación superior/profesora de educación superiora
Occupation,http://data.europa.eu/esco/occupation/99492920-e5a5-4dba-9e5a-93193147198c,economista,released,,"Los economistas llevarán a cabo actividades de investigación y desarrollo teorías en el ámbito de la economía, tanto para el análisis microeconómico o macroeconómico como para el análisis macroeconómico. Estudian las tendencias, analizan los datos estadísticos y, en cierta medida, trabajan con modelos matemáticos económicos con el fin de asesorar a las empresas, los gobiernos y las instituciones relacionadas. Asesoran sobre la viabilidad de los productos, las previsiones de tendencias, los mercados emergentes, las políticas fiscales y las tendencias de los consumidores.",http://data.europa.eu/esco/isco/C2631,Economistas
Occupation,http://data.europa.eu/esco/occupation/9a7e780a-b778-4a5a-b4eb-309d394d313d,profesor universitario de literatura/profesora universitaria de literatura,released,profesora universitaria de literatura | profesor universitario de literatura,"Los profesores universitarios de literatura son catedráticos de dicha materia, profesores, o profesores universitarios que forman en su disciplina de especialidad, la literatura —de carácter predominantemente académico— a estudiantes que han obtenido un título de enseñanza secundaria posobligatoria. Trabajan con sus ayudantes de investigación y ayudantes de apoyo al profesorado universitario en la preparación de clases teóricas y exámenes, en la puntuación de trabajos y exámenes, así como en la dirección de sesiones de repaso y tutorías para los estudiantes. También llevan a cabo investigaciones académicas en su respectiva área de especialidad dentro del ámbito de la literatura, publican sus trabajos y colaboran con otros compañeros de trabajo en la universidad.",http://data.europa.eu/esco/occupation/684fd8d5-9b40-4b02-a680-438f0082d923,profesor de educación superior/profesora de educación superiora
Occupation,http://data.europa.eu/esco/occupation/9b889f07-c39c-464d-b9d9-b2daa650f9ac,médico especialista/médica especialista,released,médica especialista | médico especialista,"Los médicos especialistas previenen, diagnostican y tratan enfermedades en función de su especialidad médica o quirúrgica.",http://data.europa.eu/esco/isco/C2212,Médicos especialistas
Occupation,http://data.europa.eu/esco/occupation/a36c14e6-ed96-467d-8390-6f9cf47ac350,profesor universitario de historia/profesora universitaria de historia,released,profesor universitario de historia | profesora universitaria de historia,"Los profesores universitarios de historia son catedráticos de dicha materia, profesores, o profesores universitarios que forman en su disciplina de especialidad, la historia —de carácter predominantemente académico— a estudiantes que han obtenido un título de enseñanza secundaria posobligatoria. Trabajan con sus ayudantes de investigación y ayudantes de apoyo al profesorado universitario en la preparación de clases teóricas y exámenes, en la puntuación de trabajos y exámenes, así como en la dirección de sesiones de repaso y tutorías para los estudiantes. También llevan a cabo investigaciones académicas en su respectiva área de especialidad dentro del ámbito de la historia, publican sus trabajos y colaboran con otros compañeros de trabajo en la universidad.",http://data.europa.eu/esco/occupation/684fd8d5-9b40-4b02-a680-438f0082d923,profesor de educación superior/profesora de educación superiora
Occupation,http://data.europa.eu/esco/occupation/a63733fa-f7ff-4733-8961-1ec4eeaab00b,museólogo/museóloga,released,conservadora de museo | conservador de museo | museólogo | museóloga,"Los museólogos llevan a cabo o gestionan el trabajo de conservación, preparatorio y administrativo de museos generales, jardines botánicos, galerías de arte, colecciones de bellas artes, acuarios o lugares similares. Gestionan colecciones de material natural, histórico y antropológico de carácter educativo, científico o estético.
	",http://data.europa.eu/esco/isco/C2621,Archivistas y curadores de museos
Occupation,http://data.europa.eu/esco/occupation/a7a74a05-3dd0-46c6-99af-92df8042520c,microbiólogo/microbióloga,released,microbióloga | microbiólogo,"Los microbiólogos estudian e investigan las formas, las características y los procesos vitales de organismos microscópicos. Estudian microorganismos tales como bacterias, protozoos, hongos, etc., a fin de diagnosticar y contrarrestar los efectos que estos microorganismos pueden tener en los animales, el medio ambiente, la industria alimentaria o el sector de la atención sanitaria.
	",http://data.europa.eu/esco/occupation/eee68e13-8248-43bb-a9fb-959832a6c217,biólogo/bióloga
Occupation,http://data.europa.eu/esco/occupation/a9c7a04d-807a-41b5-b441-87c73c73c9c5,lingüista,released,lingüista computacional | filóloga | terminóloga | terminólogo | investigador en lingüística | filólogo | investigadora en lingüística,"Los lingüistas estudian las lenguas de manera científica. Dominan las lenguas y pueden interpretarlas desde un punto de vista gramatical, semántico y fonético. Investigan la evolución de la lengua y la forma en que las sociedades utilizan.",http://data.europa.eu/esco/isco/C2643,"Traductores, intérpretes y lingüistas"
Occupation,http://data.europa.eu/esco/occupation/ab360abd-32e2-4e03-967d-a10758efffa7,ingeniero mecatrónico/ingeniera mecatrónica,released,ingeniera mecatrónica | ingeniero mecatrónico,"Los ingenieros mecatrónicos diseñan y desarrollan sistemas inteligentes, como dispositivos robóticos, electrodomésticos inteligentes, y aviones, combinando tecnologías de ingeniería mecánica, electrónica, informática y de control. Elaboran planos o documentos de diseño para piezas, conjuntos o productos acabados que utilizan programas de software, y también supervisan y gestionan proyectos.",http://data.europa.eu/esco/occupation/579254cf-6d69-4889-9000-9c79dc568644,ingeniero mecánico/ingeniera mecánica
Occupation,http://data.europa.eu/esco/occupation/ab3c4d3e-3189-47ad-82af-57cdae3cb589,ingeniero en óptica/ingeniera en óptica,released,ingeniera en óptica | ingeniero óptico,"Los ingenieros en óptica diseñan y desarrollan diferentes aplicaciones industriales equipadas con sistemas ópticos. Tienen conocimientos de luz, principios de transmisión de luz y óptica para diseñar especificaciones técnicas de equipos tales como microscopios, lentes, telescopios y otros dispositivos ópticos.",http://data.europa.eu/esco/isco/C2149,Ingenieros no clasificados bajo otros epígrafes
Occupation,http://data.europa.eu/esco/occupation/ac8b3cd1-a127-4e6a-8208-5cfcf7111955,estadístico/estadística,released,estadística | especialista en estadística | estadístico,"Los estadísticos recopilan, tabulan y, lo que es más importante, analizan la información cuantitativa procedente de una variada gama de campos. Interpretan y analizan estudios estadísticos en ámbitos como la salud, la demografía, las finanzas, las empresas, etc., y asesoran basándose en patrones y conclusiones extraídas.",http://data.europa.eu/esco/isco/C2120,"Matemáticos, actuarios y estadísticos"
Occupation,http://data.europa.eu/esco/occupation/acf69cab-8629-45c8-ae10-c8fb15f474b6,antropólogo/antropóloga,released,antropólogo | antropóloga | etnólogo | etnóloga,"Los antropólogos investigan todos los aspectos de la vida de las personas. Estudian las distintas civilizaciones que han existido a lo largo del tiempo y sus modos de organización. Intentan analizar los aspectos físicos, lingüísticos, políticos, económicos, filosóficos y culturales de las distintas personas. Su objetivo es comprender y describir el pasado de la humanidad y resolver problemas sociales de actualidad. Estudian distintas perspectivas, como la antropología filosófica.",http://data.europa.eu/esco/isco/C2632,"Sociólogos, antropólogos y afines"
Occupation,http://data.europa.eu/esco/occupation/ae2c1bf4-669e-4fec-a7d7-698753699083,profesor universitario de filosofía/profesora universitaria de filosofía,released,profesora universitaria de filosofía | profesor universitario de filosofía,"Los profesores universitarios de filosofía son catedráticos de dicha materia, profesores, o profesores universitarios que forman en su disciplina de especialidad, la filosofía —de carácter predominantemente académico— a estudiantes que han obtenido un título de enseñanza secundaria posobligatoria. Trabajan con sus ayudantes de investigación y ayudantes de apoyo al profesorado universitario en la preparación de clases teóricas y exámenes, en la puntuación de trabajos y exámenes, así como en la dirección de sesiones de repaso y tutorías para los estudiantes. También llevan a cabo investigaciones académicas en su respectiva área de especialidad dentro del ámbito de la filosofía, publican sus trabajos y colaboran con otros compañeros de trabajo en la universidad.",http://data.europa.eu/esco/occupation/684fd8d5-9b40-4b02-a680-438f0082d923,profesor de educación superior/profesora de educación superiora
Occupation,http://data.europa.eu/esco/occupation/ae8b19cc-8c6e-4a16-ada2-c15f97ded133,ingeniero en optomecánica/ingeniera en optomecánica,released,ingeniero especialista en optomecánica | ingeniera especialista en optomecánica,"Los ingenieros en optomecánica diseñan y desarrollan sistemas, dispositivos y componentes optomecánicos, como los espejos ópticos y los soportes ópticos. La ingeniería optomecánica combina la ingeniería óptica con la ingeniería mecánica en el diseño de estos sistemas y dispositivos. Estos ingenieros llevan a cabo estudios, realizan análisis, someten los dispositivos a pruebas y supervisan la investigación.",http://data.europa.eu/esco/occupation/579254cf-6d69-4889-9000-9c79dc568644,ingeniero mecánico/ingeniera mecánica
Occupation,http://data.europa.eu/esco/occupation/b0f3f595-4965-4f13-ba5c-f6049b62469f,experto en biometría/experta en biometría,released,experto en biometría | experta en sistemas biométricos | experto en sistemas biométricos | especialista en biometría | experta en biometría | biometrista,"Los expertos en biometría llevan a cabo actividades de investigación en el ámbito de la biometría. Llevan a cabo proyectos de investigación estadísticos o biológicos mediante la medición de las impresiones dactilares, la retina y las formas humanas para aplicaciones médicas o industriales.",http://data.europa.eu/esco/occupation/ac8b3cd1-a127-4e6a-8208-5cfcf7111955,estadístico/estadística
Occupation,http://data.europa.eu/esco/occupation/b2cede50-82bb-4684-9f11-1930e12ad672,ingeniero en energía/ingeniera en energía,released,ingeniera en energía | ingeniero en energía,"Los ingenieros en energía diseñan nuevas formas eficientes y limpias de producir, transformar y distribuir energía para mejorar la sostenibilidad medioambiental y la eficiencia energética. Extraen energía mediante recursos naturales, como el petróleo o el gas, o fuentes renovables y sostenibles, como la energía eólica o solar. ",http://data.europa.eu/esco/isco/C2149,Ingenieros no clasificados bajo otros epígrafes
Occupation,http://data.europa.eu/esco/occupation/b3ebf55f-5e50-4262-946a-f08d7fbe29b2,profesor universitario de especialidades médicas/profesora universitaria de especialidades médicas,released,profesora universitaria de especialidades médicas | profesor universitario de especialidades médicas,"Los profesores universitarios de especialidades médicas son catedráticos de dicha materia, profesores, o profesores universitarios, y, a menudo, médicos que forman en su disciplina de especialidad, las especialidades médicas —de carácter predominantemente académico— a estudiantes que han obtenido un título de enseñanza secundaria posobligatoria. Trabajan con sus ayudantes de investigación y ayudantes de apoyo al profesorado universitario en la preparación de clases teóricas y exámenes, para la puntuación de trabajos y exámenes, para dirigir las prácticas de laboratorio, así como para llevar a cabo revisiones y sesiones de información para los estudiantes. También llevan a cabo investigaciones académicas en su respectiva área de especialidad dentro del ámbito de las especialidades médicas, publican sus trabajos y colaboran con otros compañeros de trabajo en la universidad.",http://data.europa.eu/esco/occupation/684fd8d5-9b40-4b02-a680-438f0082d923,profesor de educación superior/profesora de educación superiora
