conceptType,conceptUri,preferredLabel,status,altLabels,description,broaderConceptUri,broaderConceptPT
Occupation,http://data.europa.eu/esco/occupation/01ffb917-98dc-48c1-91ad-93c4104e791d,ingeniero biomédico/ingeniera biomédica,released,ingeniera biomédica | ingeniero biomédico,"Los ingenieros biomédicos combinan el conocimiento de principios de ingeniería y de hallazgos biológicos para el desarrollo de tratamientos médicos y medicamentos, así como  para la aplicación a la asistencia sanitaria en general. Pueden desarrollar soluciones que van desde la mejora de los componentes de medicamentos convencionales hasta la innovación en implantes, pasando por el tratamiento de tejidos.",http://data.europa.eu/esco/occupation/f9433fdb-dde1-46cf-9e91-b49d243946a7,bioingeniero/bioingeniera
Occupation,http://data.europa.eu/esco/occupation/0611f232-b30e-46c7-9c26-2d59b1448e79,criminólogo/criminóloga,released,criminólogo | criminóloga,"Los criminólogos estudian las condiciones relacionadas con los seres humanos, como los aspectos sociales y psicológicos que podrían llevarles a cometer actos delictivos. Observan y analizan diferentes factores que van desde las condiciones de comportamiento hasta el entorno social y el medio ambiente de los sospechosos para asesorar a las organizaciones sobre la prevención de la delincuencia.",http://data.europa.eu/esco/isco/C2632,"Sociólogos, antropólogos y afines"
Occupation,http://data.europa.eu/esco/occupation/0959cd1d-f6c8-4362-939a-ad7d5f75d659,profesor universitario de economía/profesora universitaria de economía,released,profesora universitaria de economía | profesor universitario de economía,"Los profesores universitarios de economía son catedráticos de dicha materia, catedráticos auxiliares, profesores, profesores universitarios, profesores universitarios colaboradores o tutores que forman a los estudiantes en su especialidad de estudio, la economía. Elaboran un plan de estudios, preparan clases (clases teóricas, clases prácticas, seminarios, sesiones de formación, etc.), hacen un seguimiento de los resultados del aprendizaje y supervisan la rama de estudio de los alumnos. Llevan a cabo investigaciones académicas en su campo de la economía y presentan sus trabajos en congresos y en publicaciones. Participan en algunas funciones de gestión de las universidades.",http://data.europa.eu/esco/occupation/684fd8d5-9b40-4b02-a680-438f0082d923,profesor de educación superior/profesora de educación superiora
Occupation,http://data.europa.eu/esco/occupation/0bf5d25a-2b4d-43b5-b053-beeb210fa43a,profesor universitario de medicina/profesora universitaria de medicina,released,profesor universitario de medicina | profesora universitaria de medicina,"Los profesores universitarios de medicina son catedráticos de dicha materia, profesores, o profesores universitarios y a menudo médicos que forman en su disciplina de especialidad, la medicina —de carácter predominantemente académico— a estudiantes que han obtenido un título de enseñanza secundaria posobligatoria. Trabajan con sus ayudantes de investigación y ayudantes de apoyo al profesorado universitario en la preparación de clases teóricas y exámenes, en la puntuación de trabajos y exámenes, en la dirección de las prácticas de laboratorio, así como en la dirección de sesiones de repaso y tutorías para los estudiantes. También llevan a cabo investigaciones académicas en su área de especialidad dentro del ámbito de la medicina, publican sus trabajos y colaboran con otros compañeros de trabajo en la universidad.",http://data.europa.eu/esco/occupation/684fd8d5-9b40-4b02-a680-438f0082d923,profesor de educación superior/profesora de educación superiora
Occupation,http://data.europa.eu/esco/occupation/0c7c9606-fde3-4658-8136-8fe0c9b8bd09,ingeniero especializado en productos sanitarios/ingeniera especializada en productos sanitarios,released,ingeniero biomédico | ingeniera biomédica | ingeniera especializada en productos sanitarios | ingeniero especializado en productos sanitarios,"Los ingenieros especializados en productos sanitarios diseñan y desarrollan sistemas, instalaciones y equipos técnico-sanitarios tales como marcapasos, escáneres de resonancia magnética (IRM) y aparatos de rayos X. Hacen un seguimiento de todo el proceso de fabricación desde el diseño conceptual hasta la aplicación del producto. Entre las actividades emprendidas figuran el diseño de mejoras en los productos, el desarrollo de métodos y técnicas para evaluar la idoneidad de diseño, la coordinación de la producción inicial, el desarrollo de procedimientos de ensayo y el diseño de diagramas de fabricación.",http://data.europa.eu/esco/occupation/4d34a9ee-2653-4da0-bef7-f59294577224,ingeniero electrónico/ingeniera electrónica
Occupation,http://data.europa.eu/esco/occupation/0cd729a6-ed11-4338-ac4b-d4b924390128,historiador/historiadora,released,historiadora | historiador,"Los historiadores investigan, analizan, interpretan y presentan el pasado de las sociedades humanas. Analizan documentos, fuentes y rastros del pasado para comprender las sociedades anteriores.",http://data.europa.eu/esco/isco/C2633,"Filósofos, historiadores y especialistas en ciencias políticas"
Occupation,http://data.europa.eu/esco/occupation/0d93706d-32fd-4de3-aa08-be1003e325da,químico/química,released,química | químico,Los químicos llevan a cabo investigaciones de laboratorio mediante ensayos y análisis de la estructura química de sustancias. Traducen los resultados de la investigación en procesos de producción industrial que a su vez se utilizan en el desarrollo o la mejora de productos. Los químicos también someten los productos manufacturados a pruebas de calidad y de evaluación de su impacto medioambiental.,http://data.europa.eu/esco/isco/C2113,Químicos
Occupation,http://data.europa.eu/esco/occupation/10291962-c0c7-4e5b-a7ed-0762b4d9b010,farmacólogo/farmacóloga,released,farmacólogo | farmacóloga,"Los farmacólogos estudian la manera en que las drogas y los medicamentos interactúan con los organismos, los sistemas de vida y sus partes (células, tejidos u órganos). Su investigación tiene por objeto identificar las sustancias que pueden ser ingeridas por los seres humanos y que ejercen funciones bioquímicas adecuadas para curar enfermedades.",http://data.europa.eu/esco/isco/C2131,"Biólogos, botánicos, zoólogos y afines"
Occupation,http://data.europa.eu/esco/occupation/116b4c55-5bd0-41e9-9227-98d7ecffeaf6,profesor universitario de sociología/profesora universitaria de sociología,released,profesor universitario de sociología | profesora universitaria de sociología,"Los profesores universitarios de sociología son catedráticos de dicha materia, profesores, o profesores universitarios que forman en su disciplina de especialidad, la sociología —de carácter predominantemente académico— a estudiantes que han obtenido un título de enseñanza secundaria posobligatoria. Trabajan con sus ayudantes de investigación y ayudantes de apoyo al profesorado universitario en la preparación de clases teóricas y exámenes, en la puntuación de trabajos y exámenes, y en la dirección de sesiones de repaso y tutorías para los estudiantes. También llevan a cabo investigaciones académicas en su área de especialidad dentro del ámbito de la sociología, publican sus trabajos y colaboran con otros compañeros de trabajo en la universidad.",http://data.europa.eu/esco/occupation/684fd8d5-9b40-4b02-a680-438f0082d923,profesor de educación superior/profesora de educación superiora
Occupation,http://data.europa.eu/esco/occupation/11a6d0f6-e692-4774-aa5f-193b67d31022,kinesiólogo/kinesióloga,released,kinesióloga | kinesiólogo,"Los kinesiólogos estudian e investigan el movimiento del cuerpo, sus músculos y partes. Analizan y utilizan datos y métodos científicos para mejorar el movimiento corporal, generalmente en seres humanos, gracias a la comprensión de ámbitos tales como la fisiología, la cinética, la neurología y la biología. Reconocen los efectos que algunos factores, como la condición física, tienen en el movimiento y desarrollan soluciones para mejorar la mecánica y la movilidad en general.",http://data.europa.eu/esco/isco/C2269,Profesionales de la salud no clasificados bajo otros epígrafes
Occupation,http://data.europa.eu/esco/occupation/11b6390b-1e48-4903-a5df-d3e04b451a19,químico cosmético/química cosmética,released,química cosmética | químico cosmético,"Los químicos cosméticos desarrollan fórmulas para crear y examinar nuevos productos cosméticos, además de mejorar los productos cosméticos existentes, como los perfumes y las fragancias, los pintalabios, las lociones y el maquillaje resistentes al agua, los tintes capilares, los jabones y los detergentes con propiedades especiales, los medicamentos de aplicación por vía tópica o los complementos para la salud.",http://data.europa.eu/esco/occupation/0d93706d-32fd-4de3-aa08-be1003e325da,químico/química
Occupation,http://data.europa.eu/esco/occupation/11d72bd6-779a-4643-9962-313833740094,científico medioambiental/científica medioambiental,released,químico del medio ambiente | química del medio ambiente | científica ambientalista | científico ambientalista,"Los científicos medioambientales detectan problemas y encuentran soluciones para reducir al mínimo los peligros para el medio ambiente mediante el análisis de muestras de aire, agua o suelo. Asesoran sobre o desarrollan políticas medioambientales y tienen como objetivo mejorar la conservación de las reservas de agua y la mejora de la gestión de los vertederos. Llevan a cabo evaluaciones de riesgos para el medioambiente y analizan las repercusiones para este de nuevas soluciones, obras de construcción o alteraciones medioambientales, además de asegurarse del cumplimiento de los reglamentos de protección del medio ambiente.",http://data.europa.eu/esco/isco/C2133,Profesionales de la protección medioambiental
Occupation,http://data.europa.eu/esco/occupation/11df8941-508c-4103-ad40-52cdf9430a59,sociólogo/socióloga,released,socióloga | sociólogo,"Los sociólogos centran su investigación en explicar el comportamiento social y el modo en que las personas se han organizado como una sociedad. Investigan y explican el modo en que las sociedades han evolucionado describiendo sus sistemas jurídicos, políticos y económicos y sus expresiones culturales.",http://data.europa.eu/esco/isco/C2632,"Sociólogos, antropólogos y afines"
Occupation,http://data.europa.eu/esco/occupation/1738173e-ef9c-4222-88c8-b6aa9bad3cf7,biofísico/biofísica,released,biofísica | biofísico,"Los biofísicos estudian la relación existente entre los organismos vivos y la física. Llevan a cabo investigaciones sobre los organismos vivos, basadas en los métodos de la física, y cuyo objetivo es explicar la complejidad de la vida, predecir pautas y extraer conclusiones sobre aspectos de la vida. Sus campos de investigación abarcan desde el ADN y las proteínas, pasando por las moléculas y las células, hasta los entornos.",http://data.europa.eu/esco/occupation/eee68e13-8248-43bb-a9fb-959832a6c217,biólogo/bióloga
Occupation,http://data.europa.eu/esco/occupation/19db5ad1-ffbf-41a0-8746-d3878f0d5dbd,especialista en medios de comunicación,released,investigador de los medios de comunicación | investigadora de los medios de comunicación,"Los especialistas en medios de comunicación investigan el papel e impacto de los medios de comunicación en la sociedad. Observan y documentan el uso de diferentes tipos de medios como periódicos, radio y televisión, así como la respuesta de la sociedad.",http://data.europa.eu/esco/occupation/acf69cab-8629-45c8-ae10-c8fb15f474b6,antropólogo/antropóloga
Occupation,http://data.europa.eu/esco/occupation/1bbaf82c-67ae-4beb-9a55-7298acf5b2af,profesor universitario de enfermería/profesora universitaria de enfermería,released,profesor universitario de enfermería | profesora de escuela superior de enfermería | profesor de escuela superior de enfermería | profesora universitaria de enfermería,"Los profesores universitarios de enfermería son catedráticos de dicha materia, profesores, o profesores universitarios, y, a menudo, médicos que forman en su disciplina de especialidad, la enfermería —de carácter predominantemente académico— a estudiantes que han obtenido un título de enseñanza secundaria posobligatoria. Trabajan con sus ayudantes de investigación y ayudantes de apoyo al profesorado universitario en la preparación de clases teóricas y exámenes, para la puntuación de trabajos y exámenes, para dirigir las prácticas de laboratorio, así como para llevar a cabo sesiones de repaso y tutorías para los estudiantes. También llevan a cabo investigaciones académicas en sus respectivas áreas de especialidad dentro del ámbito de la enfermería, publican sus trabajos y colaboran con otros compañeros de trabajo en la universidad.",http://data.europa.eu/esco/occupation/684fd8d5-9b40-4b02-a680-438f0082d923,profesor de educación superior/profesora de educación superiora
Occupation,http://data.europa.eu/esco/occupation/1c862e14-80f8-4aa8-8f1c-fd2ca95b63ad,meteorólogo/meteoróloga,released,meteorólogo | meteoróloga,"Los meteorólogos estudian los procesos climáticos, miden y predicen patrones meteorológicos, además de prestar servicios de consultoría a diversos usuarios de información meteorológica. Elaboran modelos de previsión meteorológica, desarrollan instrumentos para la recogida de datos meteorológicos y crean estadísticas y bases de datos.",http://data.europa.eu/esco/isco/C2112,Meteorólogos
Occupation,http://data.europa.eu/esco/occupation/2026adb2-62d7-4b92-9ccb-105abdebe37d,ingeniero especialista en electromagnetismo/ingeniera especialista en electromagnetismo,released,ingeniera especialista en electromagnetismo | ingeniero especialista en electromagnetismo,"Los ingenieros especialistas en electromagnetismo diseñan y desarrollan sistemas, dispositivos y componentes electromagnéticos, como electroimanes en altavoces, cerraduras electromagnéticas, imanes conductores en máquinas de resonancia magnética, e imanes en motores eléctricos.",http://data.europa.eu/esco/occupation/86ca306c-ab99-420a-9e2a-aa73c5c4de22,ingeniero eléctrico/ingeniera eléctrica
Occupation,http://data.europa.eu/esco/occupation/203ea2ee-bbee-4aaf-83d7-2f2225f916e3,arqueólogo/arqueóloga,released,arqueóloga | arqueólogo,"Los arqueólogos investigan y estudian las anteriores civilizaciones y poblaciones mediante la recogida e inspección de materiales. Analizan y extraen conclusiones sobre una amplia gama de asuntos, tales como los sistemas de jerarquía, la lingüística, la cultura y la política, basados en el estudio de objetos, estructuras, fósiles, reliquias y articulares abandonados por estos pueblos. Los arqueólogos utilizan diversos métodos interdisciplinarios como estratigrafía, tipología, análisis en 3D, matemáticas y modelización.",http://data.europa.eu/esco/isco/C2632,"Sociólogos, antropólogos y afines"
Occupation,http://data.europa.eu/esco/occupation/25829508-63f3-41c3-affc-ddbb5c077930,fisiólogo/fisióloga,released,fisióloga | fisiólogo,"Los fisiólogos estudian y se dedican a la investigación sobre el funcionamiento de los distintos organismos vivos, sus partes constituyentes y sus interacciones. Entienden la manera en que los sistemas de vida reaccionan a factores como las enfermedades, la actividad física y el estrés, y utilizan esta información para desarrollar métodos y soluciones que permitan nivelar la eficacia de dichos estímulos en los organismos vivos.",http://data.europa.eu/esco/occupation/eee68e13-8248-43bb-a9fb-959832a6c217,biólogo/bióloga
Occupation,http://data.europa.eu/esco/occupation/258e46f9-0075-4a2e-adae-1ff0477e0f30,científico de datos/científica de datos,released,especialista en datos | científico de datos | especialista en datos de investigación | científica de datos,"Los científicos de datos detectan e interpretan fuentes de datos ricas, gestionan grandes cantidades de datos, fusionan fuentes de datos, garantizan la coherencia de los conjuntos de datos y crean visualizaciones a fin de ayudar a la comprensión de los datos. Se basan en modelos matemáticos que utilizan datos, presentan y comunican información y conclusiones sobre datos a especialistas y científicos en su equipo y, si fuera necesario, a un público no especializado, y recomiendan formas de aplicar los datos.",http://data.europa.eu/esco/isco/C2511,Analistas de sistemas
Occupation,http://data.europa.eu/esco/occupation/30058b71-fe16-45ea-a2b8-d5461c706372,profesor de escuela de negocios/profesora de escuela de negocios,released,profesor de empresariales | profesora de escuela de negocios | profesor de escuela de negocios | profesora de empresariales,"Los profesores de escuela de negocios son catedráticos de dicha materia, profesores, o profesores universitarios que forman en su disciplina de especialidad, las ciencias empresariales —de carácter predominantemente académico— a estudiantes que han obtenido un título de enseñanza secundaria posobligatoria. Trabajan con sus ayudantes de investigación y ayudantes de apoyo al profesorado universitario en la preparación de clases teóricas y exámenes, en la puntuación de trabajos y exámenes, así como en la dirección de sesiones de repaso y tutorías para los estudiantes. También llevan a cabo investigaciones académicas en su área de especialidad dentro del ámbito de las ciencias empresariales, publican sus trabajos y colaboran con otros compañeros de trabajo en la universidad.",http://data.europa.eu/esco/occupation/684fd8d5-9b40-4b02-a680-438f0082d923,profesor de educación superior/profesora de educación superiora
Occupation,http://data.europa.eu/esco/occupation/306e9867-cf55-446f-88c6-8adad5369f8c,profesor universitario de ciencias de la Tierra/profesora universitaria de ciencias de la Tierra,released,profesora universitaria de ciencias de la Tierra | profesora universitaria de geociencias | profesor universitario de ciencias de la Tierra | profesor universitario de geociencias,"Los profesores universitarios de ciencias de la Tierra son catedráticos de dicha materia, profesores, o profesores universitarios que forman en su disciplina de especialidad, las ciencias de la Tierra —de carácter predominantemente académico— a estudiantes que han obtenido un título de enseñanza secundaria posobligatoria. Trabajan con sus ayudantes de investigación y ayudantes de apoyo al profesorado universitario en la preparación de clases teóricas y exámenes, en la puntuación de trabajos y exámenes y en la dirección de sesiones de repaso y tutorías para los estudiantes. También llevan a cabo investigaciones académicas en su área de especialidad dentro del ámbito de las ciencias de la Tierra, publican sus trabajos y colaboran con otros compañeros de trabajo en la universidad.",http://data.europa.eu/esco/occupation/684fd8d5-9b40-4b02-a680-438f0082d923,profesor de educación superior/profesora de educación superiora
Occupation,http://data.europa.eu/esco/occupation/35d41f4f-334b-452e-9e31-99f376302493,ingeniero especialista en optoelectrónica/ingeniera especialista en optoelectrónica,released,ingeniero especialista en optoelectrónica | ingeniera especialista en optoelectrónica,"Los ingenieros especialistas en optoelectrónica diseñan y desarrollan sistemas y dispositivos optoelectrónicos, como sensores UV, fotodiodos y LED. La ingeniería optoelectrónica combina la ingeniería óptica con la ingeniería electrónica en el diseño de estos sistemas y dispositivos. Estos ingenieros llevan a cabo estudios, realizan análisis, someten los dispositivos a pruebas y supervisan la investigación.",http://data.europa.eu/esco/occupation/4d34a9ee-2653-4da0-bef7-f59294577224,ingeniero electrónico/ingeniera electrónica
Occupation,http://data.europa.eu/esco/occupation/3af4d6be-90b5-41f6-be06-3330dab3df73,investigador de ciencias sociales/investigadora de ciencias sociales,released,investigadora de ciencias sociales | investigador de ciencias sociales | investigadora de trabajo social | investigador de trabajo social,"Los investigadores de ciencias sociales gestionan proyectos de investigación destinados a investigar e informar sobre cuestiones sociales. En primer lugar, investigan reuniendo información mediante entrevistas, grupos claves y cuestionarios; después, organizan y analizan la información recopilada utilizando paquetes de programas informáticos. Analizan los problemas y necesidades sociales y las diferentes vías y técnicas para hacerles frente.",http://data.europa.eu/esco/occupation/11df8941-508c-4103-ad40-52cdf9430a59,sociólogo/socióloga
Occupation,http://data.europa.eu/esco/occupation/3c305542-a51b-4b96-8d45-af11ca05eaa2,profesor universitario de veterinaria/profesora universitaria de veterinaria,released,profesora universitaria de veterinaria | profesor universitario de veterinaria,"Los profesores universitarios de veterinaria son catedráticos de dicha materia, profesores, o profesores universitarios, y, a menudo, médicos que forman en su disciplina de especialidad, la medicina veterinaria —de carácter predominantemente académico— a estudiantes que han obtenido un título de enseñanza secundaria posobligatoria. Trabajan con sus ayudantes de investigación y ayudantes de apoyo al profesorado universitario en la preparación de clases teóricas y exámenes, en la puntuación de trabajos y exámenes, en la dirección de las prácticas de laboratorio, así como en la dirección de sesiones de repaso y tutorías para los estudiantes. También llevan a cabo investigaciones académicas en sus respectivas áreas de especialidad dentro del ámbito de la medicina veterinaria, publican sus trabajos y colaboran con otros compañeros de trabajo en la universidad.",http://data.europa.eu/esco/occupation/684fd8d5-9b40-4b02-a680-438f0082d923,profesor de educación superior/profesora de educación superiora
Occupation,http://data.europa.eu/esco/occupation/3d7a1284-824c-47d9-8387-b8e1cd5888b5,profesor universitario de odontología/profesora universitaria de odontología,released,profesor universitario de odontología | profesora universitaria de odontología,"Los profesores universitarios de odontología son catedráticos de dicha materia, profesores, o profesores universitarios, y, a menudo, médicos que forman en su disciplina de especialidad, la odontología —de carácter predominantemente académico— a estudiantes que han obtenido un título de enseñanza secundaria posobligatoria. Trabajan con sus ayudantes de investigación y ayudantes de apoyo al profesorado universitario en la preparación de clases teóricas y exámenes, en la puntuación de trabajos y exámenes, en la dirección de las prácticas de laboratorio, así como en la dirección de sesiones de repaso y tutorías para los estudiantes. También llevan a cabo investigaciones académicas en sus respectivas áreas de especialidad dentro del ámbito de la odontología, publican sus trabajos y colaboran con otros compañeros de trabajo en la universidad.",http://data.europa.eu/esco/occupation/684fd8d5-9b40-4b02-a680-438f0082d923,profesor de educación superior/profesora de educación superiora
Occupation,http://data.europa.eu/esco/occupation/3dbd758c-6dc0-41fe-8248-2250c9bfa4ab,climatólogo/climatóloga,released,especialista en climatología | climatólogo | climatóloga,"Los climatólogos estudian la evolución media del tiempo meteorológico y el clima desde una perspectiva a largo plazo. Investigan y analizan las condiciones meteorológicas a lo largo de la historia con el fin de pronosticar tendencias climáticas como las variaciones en la temperatura, el calentamiento global o la progresión de las condiciones meteorológicas regionales. Utilizan estas conclusiones para asesorar en materia de política medioambiental, construcción, proyectos agrícolas y asuntos sociales.",http://data.europa.eu/esco/occupation/1c862e14-80f8-4aa8-8f1c-fd2ca95b63ad,meteorólogo/meteoróloga
Occupation,http://data.europa.eu/esco/occupation/3f7b7ce5-94b6-4e0c-98e7-a4ee5a6accf4,toxicólogo/toxicóloga,released,toxicóloga | toxicólogo,"Los toxicólogos estudian los efectos que las sustancias químicas o los agentes biológicos y físicos tienen en los organismos vivos, más específicamente, en el medio ambiente y en la salud humana y animal. Determinan las dosis de exposición a sustancias responsables de efectos tóxicos en entornos, personas y organismos vivos, y también realizan experimentos con animales y cultivos celulares.",http://data.europa.eu/esco/occupation/eee68e13-8248-43bb-a9fb-959832a6c217,biólogo/bióloga
Occupation,http://data.europa.eu/esco/occupation/441a5b76-2f51-4704-9df7-3b8e715dd3ad,etólogo/etóloga,released,etóloga | etólogo,"Los etólogos investigan, observan y describen el comportamiento humano en sociedad. Extraen conclusiones sobre los motivos que inducen a acciones en humanos, observan las diversas circunstancias de los distintos comportamientos y describen personalidades diferentes. Asesoran a organizaciones e instituciones gubernamentales en este ámbito. También pueden analizar el comportamiento de los animales.",http://data.europa.eu/esco/isco/C2632,"Sociólogos, antropólogos y afines"
