conceptType,conceptUri,preferredLabel,status,altLabels,description,broaderConceptUri,broaderConceptPT
Occupation,http://data.europa.eu/esco/occupation/479ede81-bd51-4f3b-9d30-4910699fd211,profesor universitario de periodismo/profesora universitaria de periodismo,released,profesora universitaria de periodismo | profesor universitario de periodismo,"Los profesores universitarios de periodismo y comunicación audiovisual son catedráticos de dicha materia, profesores, o profesores universitarios que forman en su disciplina de especialidad, el periodismo y los medios de comunicación —de carácter predominantemente académico— a estudiantes que han obtenido un título de enseñanza secundaria posobligatoria. Trabajan con sus ayudantes de investigación y ayudantes de apoyo al profesorado universitario en la preparación de clases teóricas y exámenes, en la puntuación de trabajos y exámenes, así como en la dirección de sesiones de repaso y tutorías para los estudiantes. También llevan a cabo investigaciones académicas en sus respectivas áreas de especialidad dentro del ámbito del periodismo y los medios de comunicación, publican sus trabajos y colaboran con otros compañeros de trabajo en la universidad.",http://data.europa.eu/esco/occupation/684fd8d5-9b40-4b02-a680-438f0082d923,profesor de educación superior/profesora de educación superiora
Occupation,http://data.europa.eu/esco/occupation/49023c69-302f-4671-b26f-7229d1a53915,profesor universitario de comunicación/profesora universitaria de comunicación,released,profesor universitario de comunicación | profesora universitaria de comunicación,"Los profesores universitarios de comunicación son catedráticos de dicha materia, profesores, o profesores universitarios que forman en su disciplina de especialidad, las comunicaciones —de carácter predominantemente académico— a estudiantes que han obtenido un título de enseñanza secundaria posobligatoria. Trabajan con sus ayudantes de investigación y ayudantes de apoyo al profesorado universitario en la preparación de clases teóricas y exámenes, en la puntuación de trabajos y exámenes, así como en la dirección de sesiones de repaso y tutorías para los estudiantes. También llevan a cabo investigaciones académicas en su área de especialidad dentro del ámbito de la comunicación, publican sus trabajos y colaboran con otros compañeros de trabajo en la universidad.",http://data.europa.eu/esco/occupation/684fd8d5-9b40-4b02-a680-438f0082d923,profesor de educación superior/profesora de educación superiora
Occupation,http://data.europa.eu/esco/occupation/4b759f0e-8fec-4cf5-80d4-d112a9fd4e51,oceanógrafo/oceanógrafa,released,biólogo marino | oceanógrafo | bióloga marina | oceanógrafa,"Los oceanógrafos estudian e investigan cuestiones relacionadas con el mar y los océanos. Los oceanógrafos dividen sus conocimientos en varias ramas de investigación, que son la oceanografía física —cuya investigación se centra en las olas y las mareas—, la oceanografía química —cuyo estudio aborda la constitución química de las aguas marinas— y la oceanografía geológica —cuya investigación se centra en el fondo de los mares y las placas marinas.
   ",http://data.europa.eu/esco/occupation/c6196b21-20f9-4608-83fb-6f143afc740d,geólogo/geóloga
Occupation,http://data.europa.eu/esco/occupation/4e8a5d3e-66de-4661-9927-ef3123cc79e9,profesor universitario de arquitectura/profesora universitaria de arquitectura,released,profesor universitario de arquitectura | profesora universitaria de arquitectura,"Los profesores universitarios de arquitectura son catedráticos de dicha materia, profesores, o profesores universitarios que forman en su disciplina de especialidad, la arquitectura —de carácter predominantemente académico— a estudiantes que han obtenido un título de enseñanza secundaria posobligatoria. Trabajan con sus ayudantes de investigación y ayudantes de apoyo al profesorado universitario en la preparación de clases teóricas y exámenes, en la puntuación de trabajos y exámenes, así como en la dirección de sesiones de repaso y tutorías para los estudiantes. También llevan a cabo investigaciones académicas en su respectiva área de especialidad dentro del ámbito de la arquitectura, publican sus trabajos y colaboran con otros compañeros de trabajo en la universidad.",http://data.europa.eu/esco/occupation/684fd8d5-9b40-4b02-a680-438f0082d923,profesor de educación superior/profesora de educación superiora
Occupation,http://data.europa.eu/esco/occupation/4f4d33a1-0b41-4dd9-8a42-aeba5a3974ab,ingeniero en sensórica/ingeniera en sensórica,released,ingeniera en sensórica | ingeniera especializada en sensores | ingeniero en sensórica | ingeniero especializado en sensores,"Los ingenieros en sensórica diseñan y desarrollan sensores, sistemas de sensores y productos equipados con sensores. Además, planifican y supervisan la fabricación de estos productos.",http://data.europa.eu/esco/occupation/4d34a9ee-2653-4da0-bef7-f59294577224,ingeniero electrónico/ingeniera electrónica
Occupation,http://data.europa.eu/esco/occupation/4f89b0d2-b666-4890-af01-25d1d60da1f3,politólogo/politóloga,released,politóloga | investigadora en ciencias políticas | investigador en ciencias políticas | politólogo,"Los politólogos estudian el comportamiento, la actividad y los sistemas políticos, incluidos los elementos que entran en él. Su estudio sobre el terreno va desde los orígenes y la evolución de los diversos sistemas políticos a asuntos de actualidad como los procesos de toma de decisiones, el comportamiento político, las tendencias políticas, la sociedad y las perspectivas de poder. Asesoran a los gobiernos y a las organizaciones institucionales sobre cuestiones de gobernanza.",http://data.europa.eu/esco/isco/C2633,"Filósofos, historiadores y especialistas en ciencias políticas"
Occupation,http://data.europa.eu/esco/occupation/52ded7d7-11df-42e3-b90a-d7f4b70fb4b9,psicólogo/psicóloga,released,psicóloga | psicólogo,"Los psicólogos estudian el comportamiento y los procesos mentales en los seres humanos. Prestan servicios a los clientes que se ocupan de problemas de salud mental y cuestiones de vida como, por ejemplo, el fallecimiento, las dificultades de relación, la violencia doméstica y los abusos sexuales. También proporcionan asesoramiento para cuestiones de salud mental tales como trastornos de alimentación, trastornos por estrés postraumático y psicosis para ayudar a los clientes a rehabilitar y alcanzar un comportamiento sano.",http://data.europa.eu/esco/isco/C2634,Psicólogos
Occupation,http://data.europa.eu/esco/occupation/55167849-82cf-484e-b818-fa702a4e69e9,hidrólogo/hidróloga,released,hidrólogo | ingeniera especializada en suministro de aguas | ingeniero hidráulico | ingeniera hidráulica | ingeniero especializado en suministro de aguas | hidróloga,"Los hidrólogos investigan y estudian la calidad, los desafíos actuales y la distribución del agua en la Tierra. Estudian el abastecimiento de agua procedente de los ríos, arroyos y manantiales para determinar un uso adecuado y sostenible de esta. Planifican y desarrollan, junto con un equipo multidisciplinario de profesionales, la forma de suministrar agua a las ciudades y zonas urbanas, al mismo tiempo que garantizan un uso eficiencia de la misma así como la conservación de los recursos.",http://data.europa.eu/esco/occupation/c6196b21-20f9-4608-83fb-6f143afc740d,geólogo/geóloga
Occupation,http://data.europa.eu/esco/occupation/557f9ccc-4e46-4bb2-8d20-272cd978b152,científico veterinario,released,,"Los científicos veterinarios idean y llevan a cabo investigaciones en modelos animales, comparan la biología básica de distintos animales y trasladan los resultados de las investigaciones a diferentes especies, también el ser humano.",http://data.europa.eu/esco/isco/C2250,Veterinarios
Occupation,http://data.europa.eu/esco/occupation/55a785db-0636-41b8-950f-0b65abe5e81b,profesor universitario de farmacia/profesora universitaria de farmacia,released,profesora universitaria de farmacia | profesor universitario de farmacia,"Los profesores universitarios de farmacia son catedráticos de dicha materia, profesores, o profesores universitarios que forman en su disciplina de especialidad, la farmacia —de carácter predominantemente académico— a estudiantes que han obtenido un título de enseñanza secundaria posobligatoria. Trabajan con sus ayudantes de investigación y ayudantes de apoyo al profesorado universitario en la preparación de clases teóricas y exámenes, en la puntuación de trabajos y exámenes, en la dirección de las prácticas de laboratorio, así como en la dirección de sesiones de repaso y tutorías para los estudiantes. También llevan a cabo investigaciones académicas en su área de especialidad dentro del ámbito de la farmacia, publican sus trabajos y colaboran con otros compañeros de trabajo en la universidad.",http://data.europa.eu/esco/occupation/684fd8d5-9b40-4b02-a680-438f0082d923,profesor de educación superior/profesora de educación superiora
Occupation,http://data.europa.eu/esco/occupation/574f3232-1d07-4034-8cac-c57ddbfff192,químico analista/química analista,released,química analista | químico analista,"Los químicos analistas investigan y describen la composición química de las sustancias. Además, extraen conclusiones relacionadas con el comportamiento de estas sustancias en diversas condiciones. Los químicos analistas desempeñan un papel importante para analizar la relación entre la química y el entorno, los alimentos, los combustibles y la medicina. Utilizan una serie de técnicas como la electrocromatografía, la cromatografía de gases, la cromatografía líquida de alta resolución y la espectroscopia.
	",http://data.europa.eu/esco/occupation/0d93706d-32fd-4de3-aa08-be1003e325da,químico/química
Occupation,http://data.europa.eu/esco/occupation/57a12047-4f1e-40ed-add5-9736923f231b,astrónomo/astrónoma,released,astrónoma | astrónomo,"Los astrónomos estudian la formación, las estructuras, las propiedades y el desarrollo de los cuerpos celestes y la materia interestelar. Utilizan equipos terrestres y espaciales para recoger datos sobre el espacio con fines de investigación.",http://data.europa.eu/esco/isco/C2111,Físicos y astrónomos
Occupation,http://data.europa.eu/esco/occupation/59a02420-91df-4e46-b37b-22e3fd8c11f0,profesor universitario de física/profesora universitaria de física,released,profesora universitaria de física | profesor universitario de física,"Los profesores universitarios de física son catedráticos de dicha materia, profesores, o profesores universitarios que forman en su disciplina de especialidad, la física —de carácter predominantemente académico— a estudiantes que han obtenido un título de enseñanza secundaria posobligatoria. Trabajan con sus ayudantes de investigación y ayudantes de apoyo al profesorado universitario en la preparación de clases teóricas y exámenes, en la puntuación de trabajos y exámenes, en la dirección de las prácticas de laboratorio, así como en la dirección de sesiones de repaso y tutorías para los estudiantes. También llevan a cabo investigaciones académicas en su área de especialidad dentro del ámbito de la física, publican sus trabajos y colaboran con otros compañeros de trabajo en la universidad.",http://data.europa.eu/esco/occupation/684fd8d5-9b40-4b02-a680-438f0082d923,profesor de educación superior/profesora de educación superiora
Occupation,http://data.europa.eu/esco/occupation/5a282a39-5346-454a-b1ef-c1217c50e156,investigador en ciencias de la educación/investigadora en ciencias de la educación,released,investigadora en ciencias de la educación | investigador en ciencias de la educación | investigadora en pedagogía | investigador en pedagogía,"Los investigadores en ciencias de la educación llevan a cabo investigaciones en el ámbito de la enseñanza. Se dedican a la ampliación de los conocimientos sobre cómo funcionan los procesos educativos, los sistemas educativos y el trabajo de las personas (profesores y alumnado). Prevén ámbitos de mejora y elaboran planes para la aplicación de innovaciones. Asesoran a legisladores y responsables de la formulación de políticas acerca de cuestiones en materia de enseñanza y ayudan a planificar las políticas educativas.",http://data.europa.eu/esco/isco/C2351,Especialistas en métodos pedagógicos
Occupation,http://data.europa.eu/esco/occupation/5ac65daa-0896-4193-9f0e-8b00746b78a1,ayudante de apoyo al personal investigador universitario,released,auxiliar de investigación,Los auxiliares de investigación universitarios llevan a cabo investigaciones académicas para la universidad o facultad en la que están contratados. Pueden asistir a los catedráticos a los que se les ha asignado o al director en sus investigaciones o desarrollar su propia investigación en un campo afín al de dicho catedrático o director.,http://data.europa.eu/esco/occupation/684fd8d5-9b40-4b02-a680-438f0082d923,profesor de educación superior/profesora de educación superiora
Occupation,http://data.europa.eu/esco/occupation/5fdfa822-c1ba-477e-87cc-3d742e59310d,profesor universitario de biología/profesora universitaria de biología,released,profesora universitaria de biología | profesor universitario de biología,"Los profesores universitarios de biología son catedráticos de dicha materia, profesores, o profesores universitarios que forman en su disciplina de especialidad, la biología a estudiantes que han obtenido un título de enseñanza secundaria posobligatoria. Trabajan con sus ayudantes de investigación y ayudantes de apoyo al profesorado universitario en la preparación de clases teóricas y exámenes, en la puntuación de trabajos y exámenes, en la dirección de las prácticas de laboratorio, así como en la dirección de sesiones de repaso y tutorías para los estudiantes. También llevan a cabo investigaciones académicas en su área de especialidad dentro del ámbito de la biología, publican sus trabajos y colaboran con otros compañeros de trabajo en la universidad.",http://data.europa.eu/esco/occupation/684fd8d5-9b40-4b02-a680-438f0082d923,profesor de educación superior/profesora de educación superiora
Occupation,http://data.europa.eu/esco/occupation/605e58d6-ad27-4828-b1f5-16707f327fa0,profesor universitario de ciencias de la educación/profesora universitaria de ciencias de la educación,released,profesora universitaria de pedagogía | profesor universitario de pedagogía | profesora universitaria de ciencias de la educación | profesor universitario de ciencias de la educación,"Los profesores universitarios de ciencias de la educación son catedráticos, profesores, o profesores universitarios que forman en su disciplina de especialidad, las ciencias de la educación a estudiantes que han obtenido un título de enseñanza secundaria posobligatoria para que a su vez puedan llegar a ser profesores. Trabajan con sus ayudantes de investigación y ayudantes de apoyo al profesorado universitario en la preparación de clases teóricas y exámenes, en la puntuación de trabajos y exámenes, así como en la dirección de sesiones de repaso y tutorías para los estudiantes.",http://data.europa.eu/esco/occupation/684fd8d5-9b40-4b02-a680-438f0082d923,profesor de educación superior/profesora de educación superiora
Occupation,http://data.europa.eu/esco/occupation/6140be85-2d45-44b2-b0ba-412aadcead1e,genetista,released,embriólogo | bióloga molecular | biólogo molecular | embrióloga,"Los genetistas estudian y centran sus investigaciones en la genética. Analizan la manera en que los rasgos y las características actúan, interactúan y se heredan. Basándose en sus estudios, tratan a pacientes con enfermedades y trastornos de carácter hereditario, malformaciones congénitas y problemas genéticos en general.",http://data.europa.eu/esco/occupation/eee68e13-8248-43bb-a9fb-959832a6c217,biólogo/bióloga
Occupation,http://data.europa.eu/esco/occupation/66527cdc-b7a5-4996-9448-7e327b68d08d,profesor universitario de estudios artísticos/profesora universitaria de estudios artísticos,released,profesor universitario de estudios artísticos | profesora universitaria de estudios artísticos,"Los profesores universitarios de estudios artísticos son catedráticos de dicha materia, profesores, o profesores universitarios que forman en su disciplina de especialidad, las artes —de carácter predominantemente académico— a estudiantes que han obtenido un título de enseñanza secundaria posobligatoria. Trabajan con sus ayudantes de investigación y ayudantes de apoyo al profesorado universitario en la preparación de clases teóricas y exámenes, en la puntuación de trabajos y exámenes, así como en la dirección de sesiones de repaso y tutorías para los estudiantes. También llevan a cabo investigaciones académicas en su área de especialidad dentro del ámbito de las artes, publican sus trabajos y colaboran con otros compañeros de trabajo en la universidad.",http://data.europa.eu/esco/occupation/684fd8d5-9b40-4b02-a680-438f0082d923,profesor de educación superior/profesora de educación superiora
Occupation,http://data.europa.eu/esco/occupation/684fd8d5-9b40-4b02-a680-438f0082d923,profesor de educación superior/profesora de educación superiora,released,profesor universitario | profesora universitaria | profesora de educación superior | profesor de educación superior,"Los profesores de enseñanza superior forman en su disciplina de especialidad —de carácter predominantemente académico— a estudiantes que han obtenido un título de enseñanza secundaria posobligatoria. Pueden tener un cargo como «profesor titular» o «catedrático». Trabajan con sus ayudantes de investigación y ayudantes de apoyo al profesorado universitario en la preparación de clases teóricas y exámenes, en la puntuación de trabajos y exámenes, en la dirección de las prácticas de laboratorio, así como en la dirección de sesiones de repaso y tutorías para los estudiantes. También llevan a cabo investigaciones académicas en su respectiva área de especialidad, publican sus trabajos y colaboran con otros compañeros investigadores.",http://data.europa.eu/esco/isco/C2310,Profesores de universidades y de la enseñanza superior
Occupation,http://data.europa.eu/esco/occupation/68d973df-bf10-4bf7-9a1b-fbd9f604b9db,bioinformático/bioinformática,released,científico bioinformático | bioinformático | bioinformática | analista bioinformática | analista bioinformático | científica bioinformática,"Los bioinformáticos analizan los procesos biológicos mediante programas informáticos. Mantienen o construyen bases de datos que contienen información biológica. Reúnen y analizan datos biológicos y también pueden proporcionar asistencia a los científicos de diversos ámbitos, incluso en el ámbito de la biotecnología y en el farmacéutico. Llevan a cabo investigaciones científicas y análisis estadísticos e publican informes con sus resultados. Además, pueden recopilar muestras de ADN, descubrir patrones de datos y hacer investigaciones genéticas.",http://data.europa.eu/esco/isco/C2131,"Biólogos, botánicos, zoólogos y afines"
Occupation,http://data.europa.eu/esco/occupation/68f4fdd9-182c-4c0d-a73d-f767b8a8355e,biólogo especialista en acuicultura/bióloga especialista en acuicultura,released,biólogo especialista en acuicultura | bióloga especialista en acuicultura,"Los biólogos especialistas en acuicultura aplican los conocimientos obtenidos a raíz de sus investigaciones sobre animales y la vida vegetal en medios acuáticos así como las interacciones entre estos y su entorno a la mejora de la producción acuícola, la prevención de los problemas de salud animal y del medio ambiente y a la contribución de soluciones en caso necesario.",http://data.europa.eu/esco/occupation/eee68e13-8248-43bb-a9fb-959832a6c217,biólogo/bióloga
Occupation,http://data.europa.eu/esco/occupation/6cd08cbe-7611-4d70-8886-6c59c0385442,especialista en ciencias de la comunicación,released,especialista en comunicación,"Los especialistas en ciencias de la comunicación investigan los diferentes aspectos de la planificación, la recopilación, la creación, la organización, la conservación, la utilización, la evaluación y el intercambio de información mediante una comunicación verbal o no verbal. Estudian las interacciones entre grupos, individuos y personas con tecnologías (robots).",http://data.europa.eu/esco/occupation/acf69cab-8629-45c8-ae10-c8fb15f474b6,antropólogo/antropóloga
Occupation,http://data.europa.eu/esco/occupation/6d421d34-baa1-44f9-9ea0-231d76e325fd,investigador de las religiones/investigadora de las religiones,released,investigador de las religiones | teóloga | teólogo | investigadora de las religiones,"Los investigadores de las religiones estudian conceptos relacionados con religiones, creencias y espiritualidad. Aplican la racionalidad moral y ética de los estudios de las escrituras, la religión, la disciplina y la ley divina.",http://data.europa.eu/esco/isco/C2636,Profesionales religiosos
Occupation,http://data.europa.eu/esco/occupation/6df6c5cb-c1a2-42c8-acd0-1ee5563c36c1,bioquímico/bioquímica,released,bioquímica | bioquímico,"Los bioquímicos estudian las reacciones provocadas por sustancias químicas de organismos vivos. Esto incluye realizar investigaciones para el desarrollo o la mejora de productos con base química (p. ej., medicamentos) destinados a mejorar la salud de organismos vivos y a comprender mejor sus reacciones ante dichas sustancias.",http://data.europa.eu/esco/occupation/eee68e13-8248-43bb-a9fb-959832a6c217,biólogo/bióloga
Occupation,http://data.europa.eu/esco/occupation/6e92d4b5-3167-4166-802f-da7753951a31,consultor de investigación en TIC/consultora de investigación en TIC,released,asesor de investigaciones en TIC | asesora de investigaciones en TIC | consultora de investigaciones en TI | consultor de investigación en TIC | consultora de investigación en TIC | consultor de investigaciones en TICs | consultora de investigaciones en TICs | consultor de investigaciones en TI,"Los consultores de investigación de TIC realizan investigaciones específicas sobre las TIC y proporcionan un informe final al cliente. También utilizan herramientas de TIC para diseñar cuestionarios para encuestas, analizar los resultados, redactar informes, presentar los resultados y formular recomendaciones basadas en los resultados de la investigación.",http://data.europa.eu/esco/isco/C2511,Analistas de sistemas
Occupation,http://data.europa.eu/esco/occupation/71f09c8b-a172-408c-b9e7-32e580e39ff6,médico generalista/médica generalista,released,médica generalista | médico generalista,"Los médicos generalistas fomentan la salud, previenen enfermedades, detectan estados de mala salud, diagnostican y tratan enfermedades y promueven la recuperación de enfermedades físicas y mentales, así como trastornos de todo tipo para todas las personas, independientemente de su edad, sexo o tipo de problema de salud.",http://data.europa.eu/esco/isco/C2211,Médicos generales
Occupation,http://data.europa.eu/esco/occupation/72628f3a-fd49-499a-9741-870b0a1fcef2,matemático/matemática,released,matemática | especialista en ciencias exactas | matemático,"Los matemáticos estudian y profundizan en las teorías matemáticas existentes, con el fin de ampliar conocimientos y encontrar nuevos paradigmas en este ámbito. Pueden aplicar estos conocimientos a los retos presentados en proyectos de ingeniería y científicos con el fin de garantizar que las mediciones, las cantidades y las leyes matemáticas demuestran su viabilidad.",http://data.europa.eu/esco/isco/C2120,"Matemáticos, actuarios y estadísticos"
Occupation,http://data.europa.eu/esco/occupation/73ceb2f9-18e3-4cfe-9c06-e9fb31ece440,director del departamento de investigación y desarrollo/directora del departamento de investigación y desarrollo,released,director de investigación y desarrollo | directora de investigación y desarrollo | director del departamento de investigación y desarrollo | directora del departamento de investigación y desarrollo,"Los directores de investigación y desarrollo coordinan las labores de los científicos, los investigadores académicos, los desarrolladores de producto y los investigadores de mercado en el proceso de creación de nuevos productos, la mejora de los actuales u otras actividades de investigación, incluida la investigación científica. Gestionan y planifican las actividades de investigación y desarrollo de una organización, especifican objetivos y requisitos presupuestarios y dirigen al personal.",http://data.europa.eu/esco/isco/C1223,Directores de investigación y desarrollo
Occupation,http://data.europa.eu/esco/occupation/778c1d37-69f2-4184-ac98-03b7dbfba332,ingeniero fotónico/ingeniera fotónica,released,ingeniera fotónica | ingeniero fotónico,"Los ingenieros fotónicos se ocupan de la generación, la transmisión, la transformación y la detección de luz. Llevan a cabo actividades de investigación, diseño, montaje, ensayo y despliegue de componentes o sistemas fotónicos en múltiples campos de aplicación, desde las comunicaciones ópticas hasta la instrumentación médica, pasando por el procesamiento de materiales o la tecnología de detección.",http://data.europa.eu/esco/occupation/ab3c4d3e-3189-47ad-82af-57cdae3cb589,ingeniero en óptica/ingeniera en óptica
